```txt

10:32:16.278422 IP 10.0.0.168.netbios-dgm > 10.0.0.255.netbios-dgm: UDP, length 179
10:32:16.297860 IP 10.0.0.168.netbios-dgm > 10.0.0.255.netbios-dgm: UDP, length 201
10:32:17.539252 IP 10.0.0.168.53235 > dns.google.domain: 3729+ A? go.microsoft.com. (34)
10:32:17.548462 IP dns.google.domain > 10.0.0.168.53235: 3729 3/0/0 CNAME go.microsoft.com.edgekey.net., CNAME e11290.dspg.akamaiedge.net., A 2.18.105.186 (129)
10:32:17.784755 IP 10.0.0.168.netbios-dgm > 10.0.0.255.netbios-dgm: UDP, length 179
10:32:18.712452 IP 10.0.0.168.49678 > 103.232.55.148.http: Flags [S], seq 472885141, win 65535, options [mss 1460,nop,wscale 3,nop,nop,sackOK], length 0
10:32:18.712548 IP 10.0.0.168.49679 > 103.232.55.148.http: Flags [S], seq 4118038325, win 65535, options [mss 1460,nop,wscale 3,nop,nop,sackOK], length 0
10:32:18.985774 IP 103.232.55.148.http > 10.0.0.168.49679: Flags [S.], seq 1000694242, ack 4118038326, win 8192, options [mss 1460,nop,wscale 8,nop,nop,sackOK], length 0
10:32:18.986123 IP 10.0.0.168.49679 > 103.232.55.148.http: Flags [.], ack 1, win 32768, length 0
10:32:18.986698 IP 10.0.0.168.49679 > 103.232.55.148.http: Flags [P.], seq 1:270, ack 1, win 32768, length 269: HTTP: GET /service/ HTTP/1.1
10:32:18.987763 IP 103.232.55.148.http > 10.0.0.168.49678: Flags [S.], seq 2792565504, ack 472885142, win 8192, options [mss 1460,nop,wscale 8,nop,nop,sackOK], length 0
10:32:18.988113 IP 10.0.0.168.49678 > 103.232.55.148.http: Flags [.], ack 1, win 32768, length 0
10:32:19.263058 IP 103.232.55.148.http > 10.0.0.168.49679: Flags [P.], seq 1:1007, ack 270, win 513, length 1006: HTTP: HTTP/1.1 200 OK
10:32:19.263512 IP 10.0.0.168.49679 > 103.232.55.148.http: Flags [.], ack 1007, win 32642, length 0
10:32:19.285115 IP 10.0.0.168.netbios-dgm > 10.0.0.255.netbios-dgm: UDP, length 179
10:32:19.442585 IP 10.0.0.168.49679 > 103.232.55.148.http: Flags [P.], seq 270:600, ack 1007, win 32642, length 330: HTTP: GET /icons/blank.gif HTTP/1.1
10:32:19.443512 IP 10.0.0.168.49678 > 103.232.55.148.http: Flags [P.], seq 1:330, ack 1, win 32768, length 329: HTTP: GET /icons/back.gif HTTP/1.1
10:32:19.689764 IP 10.0.0.168.60512 > dns.google.domain: 40641+ A? config.edge.skype.com. (39)
10:32:19.690098 IP 10.0.0.168.64537 > dns.google.domain: 38140+ A? nexusrules.officeapps.live.com. (48)
10:32:19.691300 IP dns.google.domain > 10.0.0.168.60512: 40641 5/0/0 CNAME config.edge.skype.com.trafficmanager.net., CNAME l-0014.config.skype.com., CNAME config-edge-skype.l-0014.l-msedge.net., CNAME l-0014.l-msedge.net., A 13.107.42.23 (199)
10:32:19.695311 IP dns.google.domain > 10.0.0.168.64537: 38140 2/0/0 CNAME prod.nexusrules.live.com.akadns.net., A 52.109.8.21 (113)
10:32:19.696582 IP 10.0.0.168.49680 > 52.109.8.21.https: Flags [S], seq 460390540, win 64240, options [mss 1460,nop,wscale 8,nop,nop,sackOK], length 0
10:32:19.696843 IP 10.0.0.168.49681 > 13.107.42.23.https: Flags [S], seq 1431113087, win 64240, options [mss 1460,nop,wscale 8,nop,nop,sackOK], length 0
10:32:19.697870 IP 13.107.42.23.https > 10.0.0.168.49681: Flags [S.], seq 3650371353, ack 1431113088, win 65535, options [mss 1440,nop,wscale 8,nop,nop,sackOK], length 0
10:32:19.697984 IP 10.0.0.168.49681 > 13.107.42.23.https: Flags [.], ack 1, win 258, length 0
10:32:19.698692 IP 10.0.0.168.49681 > 13.107.42.23.https: Flags [P.], seq 1:187, ack 1, win 258, length 186
10:32:19.699515 IP 13.107.42.23.https > 10.0.0.168.49681: Flags [.], ack 187, win 16425, length 0
10:32:19.700790 IP 13.107.42.23.https > 10.0.0.168.49681: Flags [.], seq 1:1461, ack 187, win 16425, length 1460
10:32:19.700848 IP 13.107.42.23.https > 10.0.0.168.49681: Flags [.], seq 1461:2921, ack 187, win 16425, length 1460
10:32:19.700849 IP 13.107.42.23.https > 10.0.0.168.49681: Flags [.], seq 2921:4381, ack 187, win 16425, length 1460
10:32:19.700850 IP 13.107.42.23.https > 10.0.0.168.49681: Flags [.], seq 4381:5841, ack 187, win 16425, length 1460
10:32:19.700851 IP 13.107.42.23.https > 10.0.0.168.49681: Flags [P.], seq 5841:6463, ack 187, win 16425, length 622
10:32:19.701160 IP 10.0.0.168.49681 > 13.107.42.23.https: Flags [.], ack 2921, win 258, length 0
10:32:19.701499 IP 10.0.0.168.49681 > 13.107.42.23.https: Flags [.], ack 5841, win 258, length 0
10:32:19.711225 IP 10.0.0.168.49681 > 13.107.42.23.https: Flags [P.], seq 187:345, ack 6463, win 256, length 158
10:32:19.712039 IP 13.107.42.23.https > 10.0.0.168.49681: Flags [.], ack 345, win 16424, length 0
10:32:19.713525 IP 13.107.42.23.https > 10.0.0.168.49681: Flags [P.], seq 6463:6789, ack 345, win 16424, length 326
10:32:19.715945 IP 103.232.55.148.http > 10.0.0.168.49679: Flags [P.], seq 1007:1463, ack 600, win 511, length 456: HTTP: HTTP/1.1 200 OK
10:32:19.716095 IP 10.0.0.168.49681 > 13.107.42.23.https: Flags [P.], seq 345:982, ack 6789, win 255, length 637
10:32:19.716171 IP 10.0.0.168.49679 > 103.232.55.148.http: Flags [.], ack 1463, win 32768, length 0
10:32:19.716933 IP 13.107.42.23.https > 10.0.0.168.49681: Flags [.], ack 982, win 16421, length 0
10:32:19.719025 IP 103.232.55.148.http > 10.0.0.168.49678: Flags [P.], seq 1:526, ack 330, win 513, length 525: HTTP: HTTP/1.1 200 OK
10:32:19.719125 IP 10.0.0.168.49678 > 103.232.55.148.http: Flags [.], ack 526, win 32702, length 0
10:32:19.744414 IP 13.107.42.23.https > 10.0.0.168.49681: Flags [.], seq 6789:8249, ack 982, win 16421, length 1460
10:32:19.744455 IP 13.107.42.23.https > 10.0.0.168.49681: Flags [.], seq 8249:9709, ack 982, win 16421, length 1460
10:32:19.744457 IP 13.107.42.23.https > 10.0.0.168.49681: Flags [P.], seq 9709:10292, ack 982, win 16421, length 583
10:32:19.744497 IP 13.107.42.23.https > 10.0.0.168.49681: Flags [.], seq 10292:11752, ack 982, win 16421, length 1460
10:32:19.744559 IP 13.107.42.23.https > 10.0.0.168.49681: Flags [.], seq 11752:13212, ack 982, win 16421, length 1460
10:32:19.744561 IP 13.107.42.23.https > 10.0.0.168.49681: Flags [.], seq 13212:14672, ack 982, win 16421, length 1460
10:32:19.744562 IP 13.107.42.23.https > 10.0.0.168.49681: Flags [.], seq 14672:16132, ack 982, win 16421, length 1460
10:32:19.744564 IP 13.107.42.23.https > 10.0.0.168.49681: Flags [.], seq 16132:17592, ack 982, win 16421, length 1460
10:32:19.744565 IP 13.107.42.23.https > 10.0.0.168.49681: Flags [P.], seq 17592:18513, ack 982, win 16421, length 921
10:32:19.744598 IP 13.107.42.23.https > 10.0.0.168.49681: Flags [.], seq 18513:19973, ack 982, win 16421, length 1460
10:32:19.744653 IP 13.107.42.23.https > 10.0.0.168.49681: Flags [.], seq 19973:21433, ack 982, win 16421, length 1460
10:32:19.744654 IP 13.107.42.23.https > 10.0.0.168.49681: Flags [.], seq 21433:22893, ack 982, win 16421, length 1460
10:32:19.744655 IP 13.107.42.23.https > 10.0.0.168.49681: Flags [P.], seq 22893:23387, ack 982, win 16421, length 494
10:32:19.744772 IP 13.107.42.23.https > 10.0.0.168.49681: Flags [.], seq 23387:24847, ack 982, win 16421, length 1460
10:32:19.744781 IP 10.0.0.168.49681 > 13.107.42.23.https: Flags [.], ack 9709, win 258, length 0
10:32:19.744827 IP 13.107.42.23.https > 10.0.0.168.49681: Flags [.], seq 24847:26307, ack 982, win 16421, length 1460
10:32:19.744829 IP 13.107.42.23.https > 10.0.0.168.49681: Flags [.], seq 26307:27767, ack 982, win 16421, length 1460
10:32:19.744831 IP 13.107.42.23.https > 10.0.0.168.49681: Flags [.], seq 27767:29227, ack 982, win 16421, length 1460
10:32:19.744873 IP 13.107.42.23.https > 10.0.0.168.49681: Flags [P.], seq 29227:29737, ack 982, win 16421, length 510
10:32:19.745000 IP 10.0.0.168.49681 > 13.107.42.23.https: Flags [.], ack 11752, win 258, length 0
10:32:19.745111 IP 10.0.0.168.49681 > 13.107.42.23.https: Flags [.], ack 14672, win 258, length 0
10:32:19.745790 IP 10.0.0.168.49681 > 13.107.42.23.https: Flags [.], ack 17592, win 258, length 0
10:32:19.745807 IP 10.0.0.168.49681 > 13.107.42.23.https: Flags [.], ack 19973, win 258, length 0
10:32:19.745821 IP 10.0.0.168.49681 > 13.107.42.23.https: Flags [.], ack 22893, win 258, length 0
10:32:19.745837 IP 10.0.0.168.49681 > 13.107.42.23.https: Flags [.], ack 24847, win 258, length 0
10:32:19.745878 IP 10.0.0.168.49681 > 13.107.42.23.https: Flags [.], ack 27767, win 258, length 0
10:32:19.745895 IP 10.0.0.168.49681 > 13.107.42.23.https: Flags [.], ack 29737, win 258, length 0
10:32:19.808947 IP 52.109.8.21.https > 10.0.0.168.49680: Flags [S.], seq 1986100001, ack 460390541, win 8192, options [mss 1440,nop,wscale 8,nop,nop,sackOK], length 0
10:32:19.809188 IP 10.0.0.168.49680 > 52.109.8.21.https: Flags [.], ack 1, win 258, length 0
10:32:19.809956 IP 10.0.0.168.49680 > 52.109.8.21.https: Flags [P.], seq 1:196, ack 1, win 258, length 195
10:32:19.868697 IP 10.0.0.168.49682 > 103.232.55.148.http: Flags [S], seq 4123557391, win 65535, options [mss 1460,nop,wscale 3,nop,nop,sackOK], length 0
10:32:19.868961 IP 10.0.0.168.49683 > 103.232.55.148.http: Flags [S], seq 2110486592, win 65535, options [mss 1460,nop,wscale 3,nop,nop,sackOK], length 0
10:32:19.928298 IP 52.109.8.21.https > 10.0.0.168.49680: Flags [.], seq 1:1461, ack 196, win 513, length 1460
10:32:19.928338 IP 52.109.8.21.https > 10.0.0.168.49680: Flags [.], seq 1461:2921, ack 196, win 513, length 1460
10:32:19.928341 IP 52.109.8.21.https > 10.0.0.168.49680: Flags [.], seq 2921:4381, ack 196, win 513, length 1460
10:32:19.928343 IP 52.109.8.21.https > 10.0.0.168.49680: Flags [P.], seq 4381:5679, ack 196, win 513, length 1298
10:32:19.928631 IP 10.0.0.168.49680 > 52.109.8.21.https: Flags [.], ack 2921, win 258, length 0
10:32:19.928775 IP 10.0.0.168.49680 > 52.109.8.21.https: Flags [.], ack 5679, win 258, length 0
10:32:19.945019 IP 10.0.0.168.49680 > 52.109.8.21.https: Flags [P.], seq 196:410, ack 5679, win 258, length 214
10:32:20.059616 IP 52.109.8.21.https > 10.0.0.168.49680: Flags [P.], seq 5679:5786, ack 410, win 512, length 107
10:32:20.062013 IP 10.0.0.168.49680 > 52.109.8.21.https: Flags [P.], seq 410:1103, ack 5786, win 258, length 693
10:32:20.141096 IP 103.232.55.148.http > 10.0.0.168.49682: Flags [S.], seq 2335355755, ack 4123557392, win 8192, options [mss 1460,nop,wscale 8,nop,nop,sackOK], length 0
10:32:20.141555 IP 10.0.0.168.49682 > 103.232.55.148.http: Flags [.], ack 1, win 32768, length 0
10:32:20.142152 IP 10.0.0.168.49682 > 103.232.55.148.http: Flags [P.], seq 1:224, ack 1, win 32768, length 223: HTTP: GET /favicon.ico HTTP/1.1
10:32:20.147310 IP 103.232.55.148.http > 10.0.0.168.49683: Flags [S.], seq 681831394, ack 2110486593, win 8192, options [mss 1460,nop,wscale 8,nop,nop,sackOK], length 0
10:32:20.147601 IP 10.0.0.168.49683 > 103.232.55.148.http: Flags [.], ack 1, win 32768, length 0
10:32:20.178201 IP 52.109.8.21.https > 10.0.0.168.49680: Flags [.], seq 5786:7246, ack 1103, win 509, length 1460
10:32:20.178248 IP 52.109.8.21.https > 10.0.0.168.49680: Flags [.], seq 7246:8706, ack 1103, win 509, length 1460
10:32:20.178250 IP 52.109.8.21.https > 10.0.0.168.49680: Flags [.], seq 8706:10166, ack 1103, win 509, length 1460
10:32:20.178252 IP 52.109.8.21.https > 10.0.0.168.49680: Flags [.], seq 10166:11626, ack 1103, win 509, length 1460
10:32:20.178253 IP 52.109.8.21.https > 10.0.0.168.49680: Flags [.], seq 11626:13086, ack 1103, win 509, length 1460
10:32:20.178290 IP 52.109.8.21.https > 10.0.0.168.49680: Flags [.], seq 13086:14546, ack 1103, win 509, length 1460
10:32:20.178291 IP 52.109.8.21.https > 10.0.0.168.49680: Flags [.], seq 14546:16006, ack 1103, win 509, length 1460
10:32:20.178293 IP 52.109.8.21.https > 10.0.0.168.49680: Flags [P.], seq 16006:17263, ack 1103, win 509, length 1257
10:32:20.178770 IP 10.0.0.168.49680 > 52.109.8.21.https: Flags [.], ack 8706, win 258, length 0
10:32:20.179084 IP 10.0.0.168.49680 > 52.109.8.21.https: Flags [.], ack 11626, win 258, length 0
10:32:20.179371 IP 10.0.0.168.49680 > 52.109.8.21.https: Flags [.], ack 14546, win 258, length 0
10:32:20.179678 IP 10.0.0.168.49680 > 52.109.8.21.https: Flags [.], ack 17263, win 258, length 0
10:32:20.415166 IP 103.232.55.148.http > 10.0.0.168.49682: Flags [.], seq 1:1461, ack 224, win 513, length 1460: HTTP: HTTP/1.1 200 OK
10:32:20.415202 IP 103.232.55.148.http > 10.0.0.168.49682: Flags [.], seq 1461:2921, ack 224, win 513, length 1460: HTTP
10:32:20.415204 IP 103.232.55.148.http > 10.0.0.168.49682: Flags [.], seq 2921:4381, ack 224, win 513, length 1460: HTTP
10:32:20.415206 IP 103.232.55.148.http > 10.0.0.168.49682: Flags [.], seq 4381:5841, ack 224, win 513, length 1460: HTTP
10:32:20.415648 IP 10.0.0.168.49682 > 103.232.55.148.http: Flags [.], ack 1461, win 32768, length 0
10:32:20.415859 IP 10.0.0.168.49682 > 103.232.55.148.http: Flags [.], ack 2921, win 32768, length 0
10:32:20.416043 IP 10.0.0.168.49682 > 103.232.55.148.http: Flags [.], ack 4381, win 32768, length 0
10:32:20.416206 IP 10.0.0.168.49682 > 103.232.55.148.http: Flags [.], ack 5841, win 32768, length 0
10:32:20.688005 IP 103.232.55.148.http > 10.0.0.168.49682: Flags [.], seq 5841:7301, ack 224, win 513, length 1460: HTTP
10:32:20.688029 IP 103.232.55.148.http > 10.0.0.168.49682: Flags [.], seq 7301:8761, ack 224, win 513, length 1460: HTTP
10:32:20.688323 IP 103.232.55.148.http > 10.0.0.168.49682: Flags [.], seq 8761:10221, ack 224, win 513, length 1460: HTTP
10:32:20.688370 IP 103.232.55.148.http > 10.0.0.168.49682: Flags [.], seq 10221:11681, ack 224, win 513, length 1460: HTTP
10:32:20.688388 IP 103.232.55.148.http > 10.0.0.168.49682: Flags [.], seq 11681:13141, ack 224, win 513, length 1460: HTTP
10:32:20.688390 IP 103.232.55.148.http > 10.0.0.168.49682: Flags [.], seq 13141:14601, ack 224, win 513, length 1460: HTTP
10:32:20.688491 IP 10.0.0.168.49682 > 103.232.55.148.http: Flags [.], ack 7301, win 32768, length 0
10:32:20.688602 IP 103.232.55.148.http > 10.0.0.168.49682: Flags [.], seq 14601:16061, ack 224, win 513, length 1460: HTTP
10:32:20.688649 IP 103.232.55.148.http > 10.0.0.168.49682: Flags [.], seq 16061:17521, ack 224, win 513, length 1460: HTTP
10:32:20.688783 IP 10.0.0.168.49682 > 103.232.55.148.http: Flags [.], ack 8761, win 32768, length 0
10:32:20.688957 IP 10.0.0.168.49682 > 103.232.55.148.http: Flags [.], ack 10221, win 32768, length 0
10:32:20.689135 IP 10.0.0.168.49682 > 103.232.55.148.http: Flags [.], ack 11681, win 32768, length 0
10:32:20.689876 IP 10.0.0.168.49682 > 103.232.55.148.http: Flags [.], ack 13141, win 32768, length 0
10:32:20.689925 IP 10.0.0.168.49682 > 103.232.55.148.http: Flags [.], ack 14601, win 32768, length 0
10:32:20.689975 IP 10.0.0.168.49682 > 103.232.55.148.http: Flags [.], ack 16061, win 32768, length 0
10:32:20.690022 IP 10.0.0.168.49682 > 103.232.55.148.http: Flags [.], ack 17521, win 32768, length 0
10:32:20.785176 IP 10.0.0.168.netbios-dgm > 10.0.0.255.netbios-dgm: UDP, length 179
10:32:20.960925 IP 103.232.55.148.http > 10.0.0.168.49682: Flags [.], seq 17521:18981, ack 224, win 513, length 1460: HTTP
10:32:20.960950 IP 103.232.55.148.http > 10.0.0.168.49682: Flags [.], seq 18981:20441, ack 224, win 513, length 1460: HTTP
10:32:20.961247 IP 103.232.55.148.http > 10.0.0.168.49682: Flags [.], seq 20441:21901, ack 224, win 513, length 1460: HTTP
10:32:20.961295 IP 103.232.55.148.http > 10.0.0.168.49682: Flags [.], seq 21901:23361, ack 224, win 513, length 1460: HTTP
10:32:20.961310 IP 103.232.55.148.http > 10.0.0.168.49682: Flags [.], seq 23361:24821, ack 224, win 513, length 1460: HTTP
10:32:20.961312 IP 103.232.55.148.http > 10.0.0.168.49682: Flags [.], seq 24821:26281, ack 224, win 513, length 1460: HTTP
10:32:20.961371 IP 103.232.55.148.http > 10.0.0.168.49682: Flags [.], seq 26281:27741, ack 224, win 513, length 1460: HTTP
10:32:20.961378 IP 10.0.0.168.49682 > 103.232.55.148.http: Flags [.], ack 18981, win 32768, length 0
10:32:20.961422 IP 103.232.55.148.http > 10.0.0.168.49682: Flags [.], seq 27741:29201, ack 224, win 513, length 1460: HTTP
10:32:20.961629 IP 10.0.0.168.49682 > 103.232.55.148.http: Flags [.], ack 20441, win 32768, length 0
10:32:20.961811 IP 10.0.0.168.49682 > 103.232.55.148.http: Flags [.], ack 21901, win 32768, length 0
10:32:20.961993 IP 10.0.0.168.49682 > 103.232.55.148.http: Flags [.], ack 23361, win 32768, length 0
10:32:20.962338 IP 103.232.55.148.http > 10.0.0.168.49682: Flags [.], seq 29201:30661, ack 224, win 513, length 1460: HTTP
10:32:20.962387 IP 103.232.55.148.http > 10.0.0.168.49682: Flags [P.], seq 30661:31211, ack 224, win 513, length 550: HTTP
10:32:20.963011 IP 10.0.0.168.49682 > 103.232.55.148.http: Flags [.], ack 24821, win 32768, length 0
10:32:20.963068 IP 10.0.0.168.49682 > 103.232.55.148.http: Flags [.], ack 26281, win 32768, length 0
10:32:20.963115 IP 10.0.0.168.49682 > 103.232.55.148.http: Flags [.], ack 27741, win 32768, length 0
10:32:20.963164 IP 10.0.0.168.49682 > 103.232.55.148.http: Flags [.], ack 29201, win 32768, length 0
10:32:20.963275 IP 10.0.0.168.49682 > 103.232.55.148.http: Flags [.], ack 30661, win 32768, length 0
10:32:20.963325 IP 10.0.0.168.49682 > 103.232.55.148.http: Flags [.], ack 31211, win 32699, length 0
10:32:22.285114 IP 10.0.0.168.netbios-dgm > 10.0.0.255.netbios-dgm: UDP, length 191
10:32:23.285047 IP 10.0.0.168.netbios-dgm > 10.0.0.255.netbios-dgm: UDP, length 191
10:32:24.051216 ARP, Request who-has 10.0.0.1 tell 10.0.0.168, length 46
10:32:24.051230 ARP, Reply 10.0.0.1 is-at ee:96:ae:46:5a:36 (oui Unknown), length 28
10:32:24.285072 IP 10.0.0.168.netbios-dgm > 10.0.0.255.netbios-dgm: UDP, length 191
10:32:25.232725 IP 103.232.55.148.http > 10.0.0.168.49679: Flags [F.], seq 1463, ack 600, win 511, length 0
10:32:25.233139 IP 10.0.0.168.49679 > 103.232.55.148.http: Flags [.], ack 1464, win 32768, length 0
10:32:25.234722 IP 103.232.55.148.http > 10.0.0.168.49678: Flags [F.], seq 526, ack 330, win 513, length 0
10:32:25.235074 IP 10.0.0.168.49678 > 103.232.55.148.http: Flags [.], ack 527, win 32702, length 0
10:32:25.300702 IP 10.0.0.168.netbios-dgm > 10.0.0.255.netbios-dgm: UDP, length 191
10:32:25.916210 IP 103.232.55.148.http > 10.0.0.168.49682: Flags [F.], seq 31211, ack 224, win 513, length 0
10:32:25.916543 IP 10.0.0.168.49682 > 103.232.55.148.http: Flags [.], ack 31212, win 32699, length 0
10:32:26.300985 IP 10.0.0.168.netbios-ns > 10.0.0.255.netbios-ns: UDP, length 68
10:32:27.066168 IP 10.0.0.168.netbios-ns > 10.0.0.255.netbios-ns: UDP, length 68
10:32:27.816223 IP 10.0.0.168.netbios-ns > 10.0.0.255.netbios-ns: UDP, length 68
10:32:28.581663 IP 10.0.0.168.netbios-ns > 10.0.0.255.netbios-ns: UDP, length 68
10:32:29.332137 IP 10.0.0.168.netbios-ns > 10.0.0.255.netbios-ns: UDP, length 68
10:32:30.112946 IP 10.0.0.168.netbios-ns > 10.0.0.255.netbios-ns: UDP, length 68
10:32:30.863035 IP 10.0.0.168.netbios-ns > 10.0.0.255.netbios-ns: UDP, length 68
10:32:31.659751 IP 10.0.0.168.netbios-ns > 10.0.0.255.netbios-ns: UDP, length 68
10:32:32.410008 IP 10.0.0.168.netbios-dgm > 10.0.0.255.netbios-dgm: UDP, length 179
10:32:32.410122 IP 10.0.0.168.netbios-dgm > 10.0.0.255.netbios-dgm: UDP, length 179
10:32:32.411452 IP 10.0.0.168.netbios-dgm > 10.0.0.255.netbios-dgm: UDP, length 209
10:32:43.358542 ARP, Request who-has 10.0.0.168 tell 154.61.71.51, length 28
10:32:43.358839 ARP, Reply 10.0.0.168 is-at ca:96:8f:b3:0d:dd (oui Unknown), length 46
10:32:47.542619 IP 10.0.0.168.62919 > dns.google.domain: 59632+ A? iecvlist.microsoft.com. (40)
10:32:47.558547 IP dns.google.domain > 10.0.0.168.62919: 59632 3/0/0 CNAME ie9comview.vo.msecnd.net., CNAME cs9.wpc.v0cdn.net., A 72.21.81.200 (122)
10:32:47.559844 IP 10.0.0.168.49684 > 72.21.81.200.https: Flags [S], seq 2986910754, win 65535, options [mss 1460,nop,wscale 3,nop,nop,sackOK], length 0
10:32:47.629910 IP 72.21.81.200.https > 10.0.0.168.49684: Flags [S.], seq 2828813229, ack 2986910755, win 65535, options [mss 1460,nop,nop,sackOK,nop,wscale 9], length 0
10:32:47.630301 IP 10.0.0.168.49684 > 72.21.81.200.https: Flags [.], ack 1, win 32768, length 0
10:32:47.637943 IP 10.0.0.168.49684 > 72.21.81.200.https: Flags [P.], seq 1:194, ack 1, win 32768, length 193
10:32:47.708016 IP 72.21.81.200.https > 10.0.0.168.49684: Flags [.], ack 194, win 131, length 0
10:32:47.708080 IP 72.21.81.200.https > 10.0.0.168.49684: Flags [.], seq 1:1461, ack 194, win 131, length 1460
10:32:47.708127 IP 72.21.81.200.https > 10.0.0.168.49684: Flags [P.], seq 1461:2921, ack 194, win 131, length 1460
10:32:47.708133 IP 72.21.81.200.https > 10.0.0.168.49684: Flags [P.], seq 2921:4097, ack 194, win 131, length 1176
10:32:47.708510 IP 10.0.0.168.49684 > 72.21.81.200.https: Flags [.], ack 1461, win 32768, length 0
10:32:47.708733 IP 10.0.0.168.49684 > 72.21.81.200.https: Flags [.], ack 2921, win 32768, length 0
10:32:47.708907 IP 10.0.0.168.49684 > 72.21.81.200.https: Flags [.], ack 4097, win 32621, length 0
10:32:47.708984 IP 72.21.81.200.https > 10.0.0.168.49684: Flags [.], seq 4097:5557, ack 194, win 131, length 1460
10:32:47.709029 IP 72.21.81.200.https > 10.0.0.168.49684: Flags [P.], seq 5557:7017, ack 194, win 131, length 1460
10:32:47.709034 IP 72.21.81.200.https > 10.0.0.168.49684: Flags [P.], seq 7017:7176, ack 194, win 131, length 159
10:32:47.709176 IP 10.0.0.168.49684 > 72.21.81.200.https: Flags [.], ack 5557, win 32768, length 0
10:32:47.709596 IP 10.0.0.168.49684 > 72.21.81.200.https: Flags [.], ack 7017, win 32768, length 0
10:32:47.709648 IP 10.0.0.168.49684 > 72.21.81.200.https: Flags [.], ack 7176, win 32748, length 0
10:32:47.764571 IP 10.0.0.168.60519 > dns.google.domain: 39281+ A? ctldl.windowsupdate.com. (41)
10:32:47.774859 IP dns.google.domain > 10.0.0.168.60519: 39281 5/0/0 CNAME wu-shim.trafficmanager.net., CNAME download.windowsupdate.com.edgesuite.net., CNAME a767.dspw65.akamai.net., A 23.209.125.71, A 23.209.125.83 (197)
10:32:47.775987 IP 10.0.0.168.49685 > a23-209-125-71.deploy.static.akamaitechnologies.com.http: Flags [S], seq 373585489, win 64240, options [mss 1460,nop,wscale 8,nop,nop,sackOK], length 0
10:32:47.778024 IP a23-209-125-71.deploy.static.akamaitechnologies.com.http > 10.0.0.168.49685: Flags [S.], seq 2435437812, ack 373585490, win 29200, options [mss 1460,nop,nop,sackOK,nop,wscale 7], length 0
10:32:47.778207 IP 10.0.0.168.49685 > a23-209-125-71.deploy.static.akamaitechnologies.com.http: Flags [.], ack 1, win 256, length 0
10:32:47.778407 IP 10.0.0.168.49685 > a23-209-125-71.deploy.static.akamaitechnologies.com.http: Flags [P.], seq 1:246, ack 1, win 256, length 245: HTTP: GET /msdownload/update/v3/static/trustedr/en/disallowedcertstl.cab?3027e92ff72bd024 HTTP/1.1
10:32:47.780409 IP a23-209-125-71.deploy.static.akamaitechnologies.com.http > 10.0.0.168.49685: Flags [.], ack 246, win 237, length 0
10:32:47.781162 IP a23-209-125-71.deploy.static.akamaitechnologies.com.http > 10.0.0.168.49685: Flags [.], seq 1:1461, ack 246, win 237, length 1460: HTTP: HTTP/1.1 200 OK
10:32:47.781224 IP a23-209-125-71.deploy.static.akamaitechnologies.com.http > 10.0.0.168.49685: Flags [.], seq 1461:2921, ack 246, win 237, length 1460: HTTP
10:32:47.781227 IP a23-209-125-71.deploy.static.akamaitechnologies.com.http > 10.0.0.168.49685: Flags [.], seq 2921:4381, ack 246, win 237, length 1460: HTTP
10:32:47.781229 IP a23-209-125-71.deploy.static.akamaitechnologies.com.http > 10.0.0.168.49685: Flags [P.], seq 4381:5170, ack 246, win 237, length 789: HTTP
10:32:47.781368 IP 10.0.0.168.49685 > a23-209-125-71.deploy.static.akamaitechnologies.com.http: Flags [.], ack 2921, win 256, length 0
10:32:47.781517 IP 10.0.0.168.49685 > a23-209-125-71.deploy.static.akamaitechnologies.com.http: Flags [.], ack 5170, win 256, length 0
10:32:47.827245 IP 10.0.0.168.60054 > dns.google.domain: 17078+ A? ocsp.digicert.com. (35)
10:32:47.828472 IP dns.google.domain > 10.0.0.168.60054: 17078 2/0/0 CNAME cs9.wac.phicdn.net., A 93.184.220.29 (83)
10:32:47.828983 IP 10.0.0.168.49686 > 93.184.220.29.http: Flags [S], seq 177781433, win 64240, options [mss 1460,nop,wscale 8,nop,nop,sackOK], length 0
10:32:47.830118 IP 93.184.220.29.http > 10.0.0.168.49686: Flags [S.], seq 731261916, ack 177781434, win 65535, options [mss 1460,nop,nop,sackOK,nop,wscale 9], length 0
10:32:47.830272 IP 10.0.0.168.49686 > 93.184.220.29.http: Flags [.], ack 1, win 256, length 0
10:32:47.830446 IP 10.0.0.168.49686 > 93.184.220.29.http: Flags [P.], seq 1:237, ack 1, win 256, length 236: HTTP: GET /MFEwTzBNMEswSTAJBgUrDgMCGgUABBSAUQYBMq2awn1Rh6Doh%2FsBYgFV7gQUA95QNVbRTLtm8KPiGxvDl7I90VUCEAJ0LqoXyo4hxxe7H%2Fz9DKA%3D HTTP/1.1
10:32:47.831554 IP 93.184.220.29.http > 10.0.0.168.49686: Flags [.], ack 237, win 131, length 0
10:32:47.831895 IP 93.184.220.29.http > 10.0.0.168.49686: Flags [P.], seq 1:800, ack 237, win 131, length 799: HTTP: HTTP/1.1 200 OK
10:32:47.839507 IP 10.0.0.168.49684 > 72.21.81.200.https: Flags [P.], seq 194:320, ack 7176, win 32748, length 126
10:32:47.839722 IP 10.0.0.168.49684 > 72.21.81.200.https: Flags [P.], seq 320:560, ack 7176, win 32748, length 240
10:32:47.878476 IP 10.0.0.168.49686 > 93.184.220.29.http: Flags [.], ack 800, win 253, length 0
10:32:47.909569 IP 72.21.81.200.https > 10.0.0.168.49684: Flags [.], ack 320, win 131, length 0
10:32:47.909714 IP 72.21.81.200.https > 10.0.0.168.49684: Flags [.], ack 560, win 133, length 0
10:32:47.909754 IP 72.21.81.200.https > 10.0.0.168.49684: Flags [P.], seq 7176:7402, ack 560, win 133, length 226
10:32:47.910219 IP 10.0.0.168.49684 > 72.21.81.200.https: Flags [.], ack 7402, win 32719, length 0
10:32:47.910485 IP 72.21.81.200.https > 10.0.0.168.49684: Flags [.], seq 7402:8862, ack 560, win 133, length 1460
10:32:47.910535 IP 72.21.81.200.https > 10.0.0.168.49684: Flags [P.], seq 8862:10322, ack 560, win 133, length 1460
10:32:47.910551 IP 72.21.81.200.https > 10.0.0.168.49684: Flags [.], seq 10322:11782, ack 560, win 133, length 1460
10:32:47.910553 IP 72.21.81.200.https > 10.0.0.168.49684: Flags [P.], seq 11782:13242, ack 560, win 133, length 1460
10:32:47.910558 IP 72.21.81.200.https > 10.0.0.168.49684: Flags [.], seq 13242:14702, ack 560, win 133, length 1460
10:32:47.910582 IP 72.21.81.200.https > 10.0.0.168.49684: Flags [P.], seq 14702:16162, ack 560, win 133, length 1460
10:32:47.910592 IP 72.21.81.200.https > 10.0.0.168.49684: Flags [.], seq 16162:17622, ack 560, win 133, length 1460
10:32:47.910594 IP 72.21.81.200.https > 10.0.0.168.49684: Flags [P.], seq 17622:19082, ack 560, win 133, length 1460
10:32:47.910600 IP 72.21.81.200.https > 10.0.0.168.49684: Flags [.], seq 19082:20542, ack 560, win 133, length 1460
10:32:47.910630 IP 72.21.81.200.https > 10.0.0.168.49684: Flags [P.], seq 20542:22002, ack 560, win 133, length 1460
10:32:47.910637 IP 72.21.81.200.https > 10.0.0.168.49684: Flags [.], seq 22002:23462, ack 560, win 133, length 1460
10:32:47.910639 IP 72.21.81.200.https > 10.0.0.168.49684: Flags [P.], seq 23462:24189, ack 560, win 133, length 727
10:32:47.910822 IP 10.0.0.168.49684 > 72.21.81.200.https: Flags [.], ack 8862, win 32768, length 0
10:32:47.911013 IP 10.0.0.168.49684 > 72.21.81.200.https: Flags [.], ack 10322, win 32768, length 0
10:32:47.911202 IP 10.0.0.168.49684 > 72.21.81.200.https: Flags [.], ack 11782, win 32768, length 0
10:32:47.911383 IP 10.0.0.168.49684 > 72.21.81.200.https: Flags [.], ack 13242, win 32768, length 0
10:32:47.912646 IP 10.0.0.168.49684 > 72.21.81.200.https: Flags [.], ack 14702, win 32768, length 0
10:32:47.912698 IP 10.0.0.168.49684 > 72.21.81.200.https: Flags [.], ack 16162, win 32768, length 0
10:32:47.912740 IP 10.0.0.168.49684 > 72.21.81.200.https: Flags [.], ack 17622, win 32768, length 0
10:32:47.912781 IP 10.0.0.168.49684 > 72.21.81.200.https: Flags [.], ack 19082, win 32768, length 0
10:32:47.912903 IP 10.0.0.168.49684 > 72.21.81.200.https: Flags [.], ack 20542, win 32768, length 0
10:32:47.912951 IP 10.0.0.168.49684 > 72.21.81.200.https: Flags [.], ack 22002, win 32768, length 0
10:32:47.912995 IP 10.0.0.168.49684 > 72.21.81.200.https: Flags [.], ack 23462, win 32768, length 0
10:32:47.913035 IP 10.0.0.168.49684 > 72.21.81.200.https: Flags [.], ack 24189, win 32677, length 0
10:32:48.444187 IP 10.0.0.168.49687 > 72.21.81.200.https: Flags [S], seq 910750531, win 65535, options [mss 1460,nop,wscale 3,nop,nop,sackOK], length 0
10:32:48.514228 IP 72.21.81.200.https > 10.0.0.168.49687: Flags [S.], seq 1780122022, ack 910750532, win 65535, options [mss 1460,nop,nop,sackOK,nop,wscale 9], length 0
10:32:48.514613 IP 10.0.0.168.49687 > 72.21.81.200.https: Flags [.], ack 1, win 32768, length 0
10:32:48.527105 IP 10.0.0.168.49687 > 72.21.81.200.https: Flags [P.], seq 1:194, ack 1, win 32768, length 193
10:32:48.597133 IP 72.21.81.200.https > 10.0.0.168.49687: Flags [.], ack 194, win 131, length 0
10:32:48.597241 IP 72.21.81.200.https > 10.0.0.168.49687: Flags [.], seq 1:1461, ack 194, win 131, length 1460
10:32:48.597289 IP 72.21.81.200.https > 10.0.0.168.49687: Flags [P.], seq 1461:2921, ack 194, win 131, length 1460
10:32:48.597295 IP 72.21.81.200.https > 10.0.0.168.49687: Flags [P.], seq 2921:4097, ack 194, win 131, length 1176
10:32:48.597710 IP 10.0.0.168.49687 > 72.21.81.200.https: Flags [.], ack 1461, win 32768, length 0
10:32:48.597921 IP 10.0.0.168.49687 > 72.21.81.200.https: Flags [.], ack 2921, win 32768, length 0
10:32:48.598107 IP 10.0.0.168.49687 > 72.21.81.200.https: Flags [.], ack 4097, win 32621, length 0
10:32:48.598118 IP 72.21.81.200.https > 10.0.0.168.49687: Flags [.], seq 4097:5557, ack 194, win 131, length 1460
10:32:48.598167 IP 72.21.81.200.https > 10.0.0.168.49687: Flags [P.], seq 5557:7017, ack 194, win 131, length 1460
10:32:48.598172 IP 72.21.81.200.https > 10.0.0.168.49687: Flags [P.], seq 7017:7176, ack 194, win 131, length 159
10:32:48.598311 IP 10.0.0.168.49687 > 72.21.81.200.https: Flags [.], ack 5557, win 32768, length 0
10:32:48.598805 IP 10.0.0.168.49687 > 72.21.81.200.https: Flags [.], ack 7017, win 32768, length 0
10:32:48.598860 IP 10.0.0.168.49687 > 72.21.81.200.https: Flags [.], ack 7176, win 32748, length 0
10:32:48.662089 IP 10.0.0.168.49687 > 72.21.81.200.https: Flags [P.], seq 194:320, ack 7176, win 32748, length 126
10:32:48.662508 IP 10.0.0.168.49687 > 72.21.81.200.https: Flags [P.], seq 320:610, ack 7176, win 32748, length 290
10:32:48.732114 IP 72.21.81.200.https > 10.0.0.168.49687: Flags [.], ack 320, win 131, length 0
10:32:48.732444 IP 72.21.81.200.https > 10.0.0.168.49687: Flags [P.], seq 7176:7402, ack 320, win 131, length 226
10:32:48.732520 IP 72.21.81.200.https > 10.0.0.168.49687: Flags [.], ack 610, win 133, length 0
10:32:48.732684 IP 10.0.0.168.49687 > 72.21.81.200.https: Flags [.], ack 7402, win 32719, length 0
10:32:48.733348 IP 72.21.81.200.https > 10.0.0.168.49687: Flags [P.], seq 7402:7806, ack 610, win 133, length 404
10:32:48.733733 IP 10.0.0.168.49687 > 72.21.81.200.https: Flags [.], ack 7806, win 32669, length 0
10:33:01.078784 IP 10.0.0.168.netbios-dgm > 10.0.0.255.netbios-dgm: UDP, length 201
10:33:13.566534 ARP, Request who-has 10.0.0.168 tell 154.61.71.51, length 28
10:33:13.566891 ARP, Reply 10.0.0.168 is-at ca:96:8f:b3:0d:dd (oui Unknown), length 46
10:33:14.161738 IP 10.0.0.168.60057 > 239.255.255.250.1900: UDP, length 137
10:33:14.169782 IP 10.0.0.168.60057 > 239.255.255.250.1900: UDP, length 137
10:33:14.379004 IP 10.0.0.168.60057 > 239.255.255.250.1900: UDP, length 137
10:33:16.444177 IP 10.0.0.168.65384 > dns.google.domain: 13613+ A? fs.microsoft.com. (34)
10:33:16.454995 IP dns.google.domain > 10.0.0.168.65384: 13613 5/0/0 CNAME prod.fs.microsoft.com.akadns.net., CNAME fs-wildcard.microsoft.com.edgekey.net., CNAME fs-wildcard.microsoft.com.edgekey.net.globalredir.akadns.net., CNAME e1723.g.akamaiedge.net., A 2.16.119.157 (241)
10:33:16.456474 IP 10.0.0.168.49692 > a2-16-119-157.deploy.static.akamaitechnologies.com.https: Flags [S], seq 667197323, win 64240, options [mss 1460,nop,wscale 8,nop,nop,sackOK], length 0
10:33:16.466169 IP a2-16-119-157.deploy.static.akamaitechnologies.com.https > 10.0.0.168.49692: Flags [S.], seq 4123297119, ack 667197324, win 64240, options [mss 1460,nop,nop,sackOK,nop,wscale 7], length 0
10:33:16.466583 IP 10.0.0.168.49692 > a2-16-119-157.deploy.static.akamaitechnologies.com.https: Flags [.], ack 1, win 256, length 0
10:33:16.468695 IP 10.0.0.168.49692 > a2-16-119-157.deploy.static.akamaitechnologies.com.https: Flags [P.], seq 1:182, ack 1, win 256, length 181
10:33:16.478333 IP a2-16-119-157.deploy.static.akamaitechnologies.com.https > 10.0.0.168.49692: Flags [.], ack 182, win 501, length 0
10:33:16.478605 IP a2-16-119-157.deploy.static.akamaitechnologies.com.https > 10.0.0.168.49692: Flags [.], seq 1:1461, ack 182, win 501, length 1460
10:33:16.478651 IP a2-16-119-157.deploy.static.akamaitechnologies.com.https > 10.0.0.168.49692: Flags [P.], seq 1461:2921, ack 182, win 501, length 1460
10:33:16.478657 IP a2-16-119-157.deploy.static.akamaitechnologies.com.https > 10.0.0.168.49692: Flags [P.], seq 2921:4097, ack 182, win 501, length 1176
10:33:16.478968 IP 10.0.0.168.49692 > a2-16-119-157.deploy.static.akamaitechnologies.com.https: Flags [.], ack 2921, win 256, length 0
10:33:16.479449 IP a2-16-119-157.deploy.static.akamaitechnologies.com.https > 10.0.0.168.49692: Flags [.], seq 4097:5557, ack 182, win 501, length 1460
10:33:16.479652 IP 10.0.0.168.49692 > a2-16-119-157.deploy.static.akamaitechnologies.com.https: Flags [.], ack 5557, win 256, length 0
10:33:16.488845 IP a2-16-119-157.deploy.static.akamaitechnologies.com.https > 10.0.0.168.49692: Flags [P.], seq 5557:5899, ack 182, win 501, length 342
10:33:16.504069 IP 10.0.0.168.49692 > a2-16-119-157.deploy.static.akamaitechnologies.com.https: Flags [P.], seq 182:308, ack 5899, win 255, length 126
10:33:16.513732 IP a2-16-119-157.deploy.static.akamaitechnologies.com.https > 10.0.0.168.49692: Flags [.], ack 308, win 501, length 0
10:33:16.513978 IP a2-16-119-157.deploy.static.akamaitechnologies.com.https > 10.0.0.168.49692: Flags [P.], seq 5899:6157, ack 308, win 501, length 258
10:33:16.537732 IP 10.0.0.168.49692 > a2-16-119-157.deploy.static.akamaitechnologies.com.https: Flags [P.], seq 308:498, ack 6157, win 254, length 190
10:33:16.547383 IP a2-16-119-157.deploy.static.akamaitechnologies.com.https > 10.0.0.168.49692: Flags [.], ack 498, win 501, length 0
10:33:16.548082 IP a2-16-119-157.deploy.static.akamaitechnologies.com.https > 10.0.0.168.49692: Flags [P.], seq 6157:6557, ack 498, win 501, length 400
10:33:16.597254 IP 10.0.0.168.49692 > a2-16-119-157.deploy.static.akamaitechnologies.com.https: Flags [.], ack 6557, win 252, length 0
10:33:17.160281 IP 10.0.0.168.60057 > 239.255.255.250.1900: UDP, length 137
10:33:17.160714 IP 10.0.0.168.60057 > 239.255.255.250.1900: UDP, length 137
10:33:17.394547 IP 10.0.0.168.60057 > 239.255.255.250.1900: UDP, length 137
10:33:20.175686 IP 10.0.0.168.60057 > 239.255.255.250.1900: UDP, length 137
10:33:20.176174 IP 10.0.0.168.60057 > 239.255.255.250.1900: UDP, length 137
10:33:21.631790 IP 10.0.0.168.49692 > a2-16-119-157.deploy.static.akamaitechnologies.com.https: Flags [P.], seq 498:760, ack 6557, win 252, length 262
10:33:21.641452 IP a2-16-119-157.deploy.static.akamaitechnologies.com.https > 10.0.0.168.49692: Flags [.], ack 760, win 501, length 0
10:33:21.642087 IP a2-16-119-157.deploy.static.akamaitechnologies.com.https > 10.0.0.168.49692: Flags [P.], seq 6557:7032, ack 760, win 501, length 475
10:33:21.691191 IP 10.0.0.168.49692 > a2-16-119-157.deploy.static.akamaitechnologies.com.https: Flags [.], ack 7032, win 256, length 0
10:33:22.637921 IP 10.0.0.168.49692 > a2-16-119-157.deploy.static.akamaitechnologies.com.https: Flags [P.], seq 760:959, ack 7032, win 256, length 199
10:33:22.648710 IP a2-16-119-157.deploy.static.akamaitechnologies.com.https > 10.0.0.168.49692: Flags [P.], seq 7032:7463, ack 959, win 501, length 431
10:33:22.691063 IP 10.0.0.168.49692 > a2-16-119-157.deploy.static.akamaitechnologies.com.https: Flags [.], ack 7463, win 254, length 0
10:33:23.387931 IP 10.0.0.168.55710 > dns.google.domain: 5760+ A? ieonline.microsoft.com. (40)
10:33:23.388871 IP dns.google.domain > 10.0.0.168.55710: 5760 2/0/0 CNAME any.edge.bing.com., A 204.79.197.200 (84)
10:33:23.397493 IP 10.0.0.168.49693 > a-0001.a-msedge.net.https: Flags [S], seq 3233130725, win 65535, options [mss 1460,nop,wscale 3,nop,nop,sackOK], length 0
10:33:23.397663 IP 10.0.0.168.49694 > a-0001.a-msedge.net.https: Flags [S], seq 177815797, win 65535, options [mss 1460,nop,wscale 3,nop,nop,sackOK], length 0
10:33:23.399191 IP a-0001.a-msedge.net.https > 10.0.0.168.49694: Flags [S.], seq 1872362191, ack 177815798, win 65535, options [mss 1440,nop,wscale 8,nop,nop,sackOK], length 0
10:33:23.399357 IP a-0001.a-msedge.net.https > 10.0.0.168.49693: Flags [S.], seq 917884056, ack 3233130726, win 65535, options [mss 1440,nop,wscale 8,nop,nop,sackOK], length 0
10:33:23.399421 IP 10.0.0.168.49694 > a-0001.a-msedge.net.https: Flags [.], ack 1, win 32768, length 0
10:33:23.399519 IP 10.0.0.168.49693 > a-0001.a-msedge.net.https: Flags [.], ack 1, win 32768, length 0
10:33:23.400010 IP 10.0.0.168.49694 > a-0001.a-msedge.net.https: Flags [P.], seq 1:212, ack 1, win 32768, length 211
10:33:23.401313 IP a-0001.a-msedge.net.https > 10.0.0.168.49694: Flags [.], ack 212, win 16425, length 0
10:33:23.402886 IP a-0001.a-msedge.net.https > 10.0.0.168.49694: Flags [.], seq 1:1461, ack 212, win 16425, length 1460
10:33:23.402948 IP a-0001.a-msedge.net.https > 10.0.0.168.49694: Flags [.], seq 1461:2921, ack 212, win 16425, length 1460
10:33:23.402951 IP a-0001.a-msedge.net.https > 10.0.0.168.49694: Flags [.], seq 2921:4381, ack 212, win 16425, length 1460
10:33:23.402953 IP a-0001.a-msedge.net.https > 10.0.0.168.49694: Flags [.], seq 4381:5841, ack 212, win 16425, length 1460
10:33:23.402954 IP a-0001.a-msedge.net.https > 10.0.0.168.49694: Flags [P.], seq 5841:7035, ack 212, win 16425, length 1194
10:33:23.403049 IP 10.0.0.168.49694 > a-0001.a-msedge.net.https: Flags [.], ack 1461, win 32768, length 0
10:33:23.403149 IP 10.0.0.168.49694 > a-0001.a-msedge.net.https: Flags [.], ack 2921, win 32768, length 0
10:33:23.403216 IP 10.0.0.168.49694 > a-0001.a-msedge.net.https: Flags [.], ack 4381, win 32768, length 0
10:33:23.403283 IP 10.0.0.168.49694 > a-0001.a-msedge.net.https: Flags [.], ack 5841, win 32768, length 0
10:33:23.403426 IP 10.0.0.168.49694 > a-0001.a-msedge.net.https: Flags [.], ack 7035, win 32618, length 0
10:33:23.410862 IP 10.0.0.168.49693 > a-0001.a-msedge.net.https: Flags [P.], seq 1:212, ack 1, win 32768, length 211
10:33:23.412496 IP a-0001.a-msedge.net.https > 10.0.0.168.49693: Flags [.], ack 212, win 16425, length 0
10:33:23.413887 IP a-0001.a-msedge.net.https > 10.0.0.168.49693: Flags [.], seq 1:1461, ack 212, win 16425, length 1460
10:33:23.413896 IP a-0001.a-msedge.net.https > 10.0.0.168.49693: Flags [.], seq 1461:2921, ack 212, win 16425, length 1460
10:33:23.413897 IP a-0001.a-msedge.net.https > 10.0.0.168.49693: Flags [.], seq 2921:4381, ack 212, win 16425, length 1460
10:33:23.413917 IP a-0001.a-msedge.net.https > 10.0.0.168.49693: Flags [.], seq 4381:5841, ack 212, win 16425, length 1460
10:33:23.413918 IP a-0001.a-msedge.net.https > 10.0.0.168.49693: Flags [P.], seq 5841:7035, ack 212, win 16425, length 1194
10:33:23.414122 IP 10.0.0.168.49693 > a-0001.a-msedge.net.https: Flags [.], ack 1461, win 32768, length 0
10:33:23.414303 IP 10.0.0.168.49693 > a-0001.a-msedge.net.https: Flags [.], ack 2921, win 32768, length 0
10:33:23.414335 IP 10.0.0.168.49693 > a-0001.a-msedge.net.https: Flags [.], ack 4381, win 32768, length 0
10:33:23.414590 IP 10.0.0.168.49693 > a-0001.a-msedge.net.https: Flags [.], ack 5841, win 32768, length 0
10:33:23.414611 IP 10.0.0.168.49693 > a-0001.a-msedge.net.https: Flags [.], ack 7035, win 32618, length 0
10:33:23.439320 IP 10.0.0.168.49686 > 93.184.220.29.http: Flags [P.], seq 237:479, ack 800, win 253, length 242: HTTP: GET /MFEwTzBNMEswSTAJBgUrDgMCGgUABBTBL0V27RVZ7LBduom%2FnYB45SPUEwQU5Z1ZMIJHWMys%2BghUNoZ7OrUETfACEA%2BnRyLFPYjID1ie%2Bx%2BdSjo%3D HTTP/1.1
10:33:23.440440 IP 93.184.220.29.http > 10.0.0.168.49686: Flags [.], ack 479, win 133, length 0
10:33:23.440838 IP 93.184.220.29.http > 10.0.0.168.49686: Flags [.], seq 800:2260, ack 479, win 133, length 1460: HTTP: HTTP/1.1 200 OK
