```txt
14:43:15.391346 IP 10.4.18.169.52862 > 10.4.18.4.domain: 12932+ A? t.me. (22)
14:43:15.442064 IP 10.4.18.4.domain > 10.4.18.169.52862: 12932 1/0/0 A 149.154.167.99 (38)
14:43:18.449213 IP 10.4.18.169.49878 > 149.154.167.99.https: Flags [S], seq 3902365542, win 64240, options [mss 1460,nop,wscale 8,nop,nop,sackOK], length 0
14:43:18.615670 IP 149.154.167.99.https > 10.4.18.169.49878: Flags [S.], seq 2228899816, ack 3902365543, win 65535, options [mss 1220,nop,nop,sackOK,nop,wscale 10], length 0
14:43:18.616517 IP 10.4.18.169.49878 > 149.154.167.99.https: Flags [.], ack 1, win 514, length 0
14:43:18.619748 IP 10.4.18.169.49878 > 149.154.167.99.https: Flags [P.], seq 1:261, ack 1, win 514, length 260
14:43:18.771037 IP 149.154.167.99.https > 10.4.18.169.49878: Flags [.], ack 261, win 66, length 0
14:43:18.771123 IP 149.154.167.99.https > 10.4.18.169.49878: Flags [.], seq 1:1241, ack 261, win 66, length 1240
14:43:18.771227 IP 149.154.167.99.https > 10.4.18.169.49878: Flags [P.], seq 1241:2481, ack 261, win 66, length 1240
14:43:18.771333 IP 149.154.167.99.https > 10.4.18.169.49878: Flags [.], seq 2481:3721, ack 261, win 66, length 1240
14:43:18.771367 IP 149.154.167.99.https > 10.4.18.169.49878: Flags [P.], seq 3721:4097, ack 261, win 66, length 376
14:43:18.771474 IP 149.154.167.99.https > 10.4.18.169.49878: Flags [.], seq 4097:5337, ack 261, win 66, length 1240
14:43:18.771508 IP 149.154.167.99.https > 10.4.18.169.49878: Flags [P.], seq 5337:5652, ack 261, win 66, length 315
14:43:18.771875 IP 10.4.18.169.49878 > 149.154.167.99.https: Flags [.], ack 5652, win 514, length 0
14:43:18.780069 IP 10.4.18.169.49878 > 149.154.167.99.https: Flags [P.], seq 261:341, ack 5652, win 514, length 80
14:43:18.790016 IP 10.4.18.169.49878 > 149.154.167.99.https: Flags [P.], seq 341:559, ack 5652, win 514, length 218
14:43:18.930840 IP 149.154.167.99.https > 10.4.18.169.49878: Flags [P.], seq 5652:5923, ack 341, win 66, length 271
14:43:18.930840 IP 149.154.167.99.https > 10.4.18.169.49878: Flags [P.], seq 5923:6194, ack 341, win 66, length 271
14:43:18.931656 IP 10.4.18.169.49878 > 149.154.167.99.https: Flags [.], ack 6194, win 512, length 0
14:43:18.962080 IP 149.154.167.99.https > 10.4.18.169.49878: Flags [.], seq 6194:7434, ack 559, win 67, length 1240
14:43:18.962140 IP 149.154.167.99.https > 10.4.18.169.49878: Flags [P.], seq 7434:8674, ack 559, win 67, length 1240
14:43:18.962235 IP 149.154.167.99.https > 10.4.18.169.49878: Flags [.], seq 8674:9914, ack 559, win 67, length 1240
14:43:18.962340 IP 149.154.167.99.https > 10.4.18.169.49878: Flags [P.], seq 9914:11154, ack 559, win 67, length 1240
14:43:18.962446 IP 149.154.167.99.https > 10.4.18.169.49878: Flags [.], seq 11154:12394, ack 559, win 67, length 1240
14:43:18.962551 IP 149.154.167.99.https > 10.4.18.169.49878: Flags [P.], seq 12394:13634, ack 559, win 67, length 1240
14:43:18.962656 IP 149.154.167.99.https > 10.4.18.169.49878: Flags [.], seq 13634:14874, ack 559, win 67, length 1240
14:43:18.962762 IP 149.154.167.99.https > 10.4.18.169.49878: Flags [P.], seq 14874:16114, ack 559, win 67, length 1240
14:43:18.962867 IP 149.154.167.99.https > 10.4.18.169.49878: Flags [.], seq 16114:17354, ack 559, win 67, length 1240
14:43:18.962975 IP 149.154.167.99.https > 10.4.18.169.49878: Flags [P.], seq 17354:18594, ack 559, win 67, length 1240
14:43:18.962975 IP 10.4.18.169.49878 > 149.154.167.99.https: Flags [.], ack 14874, win 514, length 0
14:43:18.962975 IP 10.4.18.169.49878 > 149.154.167.99.https: Flags [.], ack 16114, win 514, length 0
14:43:18.963025 IP 149.154.167.99.https > 10.4.18.169.49878: Flags [P.], seq 18594:19014, ack 559, win 67, length 420
14:43:18.963200 IP 10.4.18.169.49878 > 149.154.167.99.https: Flags [.], ack 19014, win 514, length 0
14:43:25.964008 IP 10.4.18.169.49879 > 85.239.53.219.http: Flags [S], seq 4238245064, win 64240, options [mss 1460,nop,wscale 8,nop,nop,sackOK], length 0
14:43:26.035411 IP 85.239.53.219.http > 10.4.18.169.49879: Flags [S.], seq 866106259, ack 4238245065, win 64240, options [mss 1396,nop,nop,sackOK,nop,wscale 7], length 0
14:43:26.036295 IP 10.4.18.169.49879 > 85.239.53.219.http: Flags [.], ack 1, win 512, length 0
14:43:26.036484 IP 10.4.18.169.49879 > 85.239.53.219.http: Flags [P.], seq 1:119, ack 1, win 512, length 118: HTTP: GET /api/g HTTP/1.1
14:43:26.110710 IP 85.239.53.219.http > 10.4.18.169.49879: Flags [.], ack 119, win 501, length 0
14:43:26.130541 IP 85.239.53.219.http > 10.4.18.169.49879: Flags [.], seq 1:1377, ack 119, win 501, length 1376: HTTP: HTTP/1.1 200 OK
14:43:26.130602 IP 85.239.53.219.http > 10.4.18.169.49879: Flags [P.], seq 1377:2753, ack 119, win 501, length 1376: HTTP
14:43:26.130716 IP 85.239.53.219.http > 10.4.18.169.49879: Flags [P.], seq 2753:4112, ack 119, win 501, length 1359: HTTP
14:43:26.130826 IP 85.239.53.219.http > 10.4.18.169.49879: Flags [.], seq 4112:5488, ack 119, win 501, length 1376: HTTP
14:43:26.130943 IP 85.239.53.219.http > 10.4.18.169.49879: Flags [P.], seq 5488:6864, ack 119, win 501, length 1376: HTTP
14:43:26.131056 IP 85.239.53.219.http > 10.4.18.169.49879: Flags [P.], seq 6864:8208, ack 119, win 501, length 1344: HTTP
14:43:26.131173 IP 85.239.53.219.http > 10.4.18.169.49879: Flags [.], seq 8208:9584, ack 119, win 501, length 1376: HTTP
14:43:26.131289 IP 85.239.53.219.http > 10.4.18.169.49879: Flags [P.], seq 9584:10960, ack 119, win 501, length 1376: HTTP
14:43:26.131406 IP 85.239.53.219.http > 10.4.18.169.49879: Flags [.], seq 10960:12336, ack 119, win 501, length 1376: HTTP
14:43:26.131484 IP 85.239.53.219.http > 10.4.18.169.49879: Flags [P.], seq 12336:13284, ack 119, win 501, length 948: HTTP
14:43:26.131484 IP 10.4.18.169.49879 > 85.239.53.219.http: Flags [.], ack 9584, win 512, length 0
14:43:26.131504 IP 10.4.18.169.49879 > 85.239.53.219.http: Flags [.], ack 10960, win 507, length 0
14:43:26.131625 IP 10.4.18.169.49879 > 85.239.53.219.http: Flags [.], ack 13284, win 512, length 0
14:43:26.202358 IP 85.239.53.219.http > 10.4.18.169.49879: Flags [.], seq 13284:14660, ack 119, win 501, length 1376: HTTP
14:43:26.202468 IP 85.239.53.219.http > 10.4.18.169.49879: Flags [P.], seq 14660:16036, ack 119, win 501, length 1376: HTTP
14:43:26.202598 IP 85.239.53.219.http > 10.4.18.169.49879: Flags [.], seq 16036:17412, ack 119, win 501, length 1376: HTTP
14:43:26.202739 IP 85.239.53.219.http > 10.4.18.169.49879: Flags [P.], seq 17412:18788, ack 119, win 501, length 1376: HTTP
14:43:26.202815 IP 85.239.53.219.http > 10.4.18.169.49879: Flags [.], seq 18788:20164, ack 119, win 501, length 1376: HTTP
14:43:26.203494 IP 85.239.53.219.http > 10.4.18.169.49879: Flags [P.], seq 20164:21540, ack 119, win 501, length 1376: HTTP
14:43:26.203494 IP 85.239.53.219.http > 10.4.18.169.49879: Flags [.], seq 21540:22916, ack 119, win 501, length 1376: HTTP
14:43:26.203494 IP 85.239.53.219.http > 10.4.18.169.49879: Flags [P.], seq 22916:24292, ack 119, win 501, length 1376: HTTP
14:43:26.203494 IP 85.239.53.219.http > 10.4.18.169.49879: Flags [.], seq 24292:25668, ack 119, win 501, length 1376: HTTP
14:43:26.203494 IP 10.4.18.169.49879 > 85.239.53.219.http: Flags [.], ack 22916, win 512, length 0
14:43:26.203494 IP 10.4.18.169.49879 > 85.239.53.219.http: Flags [.], ack 24292, win 507, length 0
14:43:26.203494 IP 85.239.53.219.http > 10.4.18.169.49879: Flags [P.], seq 25668:27044, ack 119, win 501, length 1376: HTTP
14:43:26.203657 IP 85.239.53.219.http > 10.4.18.169.49879: Flags [.], seq 27044:28420, ack 119, win 501, length 1376: HTTP
14:43:26.203657 IP 85.239.53.219.http > 10.4.18.169.49879: Flags [P.], seq 28420:29796, ack 119, win 501, length 1376: HTTP
14:43:26.203657 IP 10.4.18.169.49879 > 85.239.53.219.http: Flags [.], ack 27044, win 512, length 0
14:43:26.203770 IP 85.239.53.219.http > 10.4.18.169.49879: Flags [.], seq 29796:31172, ack 119, win 501, length 1376: HTTP
14:43:26.203770 IP 10.4.18.169.49879 > 85.239.53.219.http: Flags [.], ack 29796, win 512, length 0
14:43:26.203891 IP 85.239.53.219.http > 10.4.18.169.49879: Flags [P.], seq 31172:32548, ack 119, win 501, length 1376: HTTP
14:43:26.203988 IP 10.4.18.169.49879 > 85.239.53.219.http: Flags [.], ack 32548, win 512, length 0
14:43:26.205325 IP 85.239.53.219.http > 10.4.18.169.49879: Flags [.], seq 32548:33924, ack 119, win 501, length 1376: HTTP
14:43:26.205435 IP 85.239.53.219.http > 10.4.18.169.49879: Flags [P.], seq 33924:35300, ack 119, win 501, length 1376: HTTP
14:43:26.205552 IP 85.239.53.219.http > 10.4.18.169.49879: Flags [.], seq 35300:36676, ack 119, win 501, length 1376: HTTP
14:43:26.205668 IP 85.239.53.219.http > 10.4.18.169.49879: Flags [P.], seq 36676:38052, ack 119, win 501, length 1376: HTTP
14:43:26.205784 IP 85.239.53.219.http > 10.4.18.169.49879: Flags [.], seq 38052:39428, ack 119, win 501, length 1376: HTTP
14:43:26.205900 IP 85.239.53.219.http > 10.4.18.169.49879: Flags [P.], seq 39428:40804, ack 119, win 501, length 1376: HTTP
14:43:26.206091 IP 10.4.18.169.49879 > 85.239.53.219.http: Flags [.], ack 40804, win 512, length 0
14:43:26.282050 IP 85.239.53.219.http > 10.4.18.169.49879: Flags [.], seq 40804:42180, ack 119, win 501, length 1376: HTTP
14:43:26.282156 IP 85.239.53.219.http > 10.4.18.169.49879: Flags [P.], seq 42180:43556, ack 119, win 501, length 1376: HTTP
14:43:26.282271 IP 85.239.53.219.http > 10.4.18.169.49879: Flags [.], seq 43556:44932, ack 119, win 501, length 1376: HTTP
14:43:26.282388 IP 85.239.53.219.http > 10.4.18.169.49879: Flags [P.], seq 44932:46308, ack 119, win 501, length 1376: HTTP
14:43:26.282508 IP 85.239.53.219.http > 10.4.18.169.49879: Flags [.], seq 46308:47684, ack 119, win 501, length 1376: HTTP
14:43:26.282534 IP 10.4.18.169.49879 > 85.239.53.219.http: Flags [.], ack 44932, win 512, length 0
14:43:26.282534 IP 10.4.18.169.49879 > 85.239.53.219.http: Flags [.], ack 46308, win 507, length 0
14:43:26.282634 IP 85.239.53.219.http > 10.4.18.169.49879: Flags [P.], seq 47684:49060, ack 119, win 501, length 1376: HTTP
14:43:26.282750 IP 85.239.53.219.http > 10.4.18.169.49879: Flags [.], seq 49060:50436, ack 119, win 501, length 1376: HTTP
14:43:26.282867 IP 85.239.53.219.http > 10.4.18.169.49879: Flags [P.], seq 50436:51812, ack 119, win 501, length 1376: HTTP
14:43:26.282867 IP 10.4.18.169.49879 > 85.239.53.219.http: Flags [.], ack 50436, win 512, length 0
14:43:26.282989 IP 85.239.53.219.http > 10.4.18.169.49879: Flags [.], seq 51812:53188, ack 119, win 501, length 1376: HTTP
14:43:26.283105 IP 85.239.53.219.http > 10.4.18.169.49879: Flags [P.], seq 53188:54564, ack 119, win 501, length 1376: HTTP
14:43:26.283222 IP 85.239.53.219.http > 10.4.18.169.49879: Flags [.], seq 54564:55940, ack 119, win 501, length 1376: HTTP
14:43:26.283222 IP 10.4.18.169.49879 > 85.239.53.219.http: Flags [.], ack 53188, win 512, length 0
14:43:26.283345 IP 85.239.53.219.http > 10.4.18.169.49879: Flags [P.], seq 55940:57316, ack 119, win 501, length 1376: HTTP
14:43:26.283462 IP 85.239.53.219.http > 10.4.18.169.49879: Flags [.], seq 57316:58692, ack 119, win 501, length 1376: HTTP
14:43:26.283462 IP 10.4.18.169.49879 > 85.239.53.219.http: Flags [.], ack 55940, win 512, length 0
14:43:26.283462 IP 10.4.18.169.49879 > 85.239.53.219.http: Flags [.], ack 57316, win 507, length 0
14:43:26.283591 IP 85.239.53.219.http > 10.4.18.169.49879: Flags [P.], seq 58692:60068, ack 119, win 501, length 1376: HTTP
14:43:26.283795 IP 10.4.18.169.49879 > 85.239.53.219.http: Flags [.], ack 60068, win 512, length 0
14:43:26.289490 IP 85.239.53.219.http > 10.4.18.169.49879: Flags [.], seq 60068:61444, ack 119, win 501, length 1376: HTTP
14:43:26.289599 IP 85.239.53.219.http > 10.4.18.169.49879: Flags [P.], seq 61444:62820, ack 119, win 501, length 1376: HTTP
14:43:26.289715 IP 85.239.53.219.http > 10.4.18.169.49879: Flags [.], seq 62820:64196, ack 119, win 501, length 1376: HTTP
14:43:26.289874 IP 85.239.53.219.http > 10.4.18.169.49879: Flags [P.], seq 64196:65572, ack 119, win 501, length 1376: HTTP
14:43:26.289949 IP 85.239.53.219.http > 10.4.18.169.49879: Flags [.], seq 65572:66948, ack 119, win 501, length 1376: HTTP
14:43:26.290064 IP 85.239.53.219.http > 10.4.18.169.49879: Flags [P.], seq 66948:68324, ack 119, win 501, length 1376: HTTP
14:43:26.290181 IP 85.239.53.219.http > 10.4.18.169.49879: Flags [.], seq 68324:69700, ack 119, win 501, length 1376: HTTP
14:43:26.290298 IP 85.239.53.219.http > 10.4.18.169.49879: Flags [P.], seq 69700:71076, ack 119, win 501, length 1376: HTTP
14:43:26.290414 IP 85.239.53.219.http > 10.4.18.169.49879: Flags [.], seq 71076:72452, ack 119, win 501, length 1376: HTTP
14:43:26.290414 IP 10.4.18.169.49879 > 85.239.53.219.http: Flags [.], ack 68324, win 512, length 0
14:43:26.290537 IP 85.239.53.219.http > 10.4.18.169.49879: Flags [P.], seq 72452:73828, ack 119, win 501, length 1376: HTTP
14:43:26.290537 IP 10.4.18.169.49879 > 85.239.53.219.http: Flags [.], ack 71076, win 512, length 0
14:43:26.290660 IP 85.239.53.219.http > 10.4.18.169.49879: Flags [.], seq 73828:75204, ack 119, win 501, length 1376: HTTP
14:43:26.290660 IP 10.4.18.169.49879 > 85.239.53.219.http: Flags [.], ack 73828, win 512, length 0
14:43:26.290783 IP 85.239.53.219.http > 10.4.18.169.49879: Flags [P.], seq 75204:76580, ack 119, win 501, length 1376: HTTP
14:43:26.290899 IP 85.239.53.219.http > 10.4.18.169.49879: Flags [.], seq 76580:77956, ack 119, win 501, length 1376: HTTP
14:43:26.291016 IP 85.239.53.219.http > 10.4.18.169.49879: Flags [P.], seq 77956:79332, ack 119, win 501, length 1376: HTTP
14:43:26.291016 IP 10.4.18.169.49879 > 85.239.53.219.http: Flags [.], ack 76580, win 512, length 0
14:43:26.291138 IP 85.239.53.219.http > 10.4.18.169.49879: Flags [.], seq 79332:80708, ack 119, win 501, length 1376: HTTP
14:43:26.291255 IP 85.239.53.219.http > 10.4.18.169.49879: Flags [P.], seq 80708:82084, ack 119, win 501, length 1376: HTTP
14:43:26.291255 IP 10.4.18.169.49879 > 85.239.53.219.http: Flags [.], ack 79332, win 512, length 0
14:43:26.291378 IP 85.239.53.219.http > 10.4.18.169.49879: Flags [.], seq 82084:83460, ack 119, win 501, length 1376: HTTP
14:43:26.291494 IP 85.239.53.219.http > 10.4.18.169.49879: Flags [P.], seq 83460:84836, ack 119, win 501, length 1376: HTTP
14:43:26.291494 IP 10.4.18.169.49879 > 85.239.53.219.http: Flags [.], ack 82084, win 512, length 0
14:43:26.291617 IP 85.239.53.219.http > 10.4.18.169.49879: Flags [.], seq 84836:86212, ack 119, win 501, length 1376: HTTP
14:43:26.291734 IP 85.239.53.219.http > 10.4.18.169.49879: Flags [P.], seq 86212:87588, ack 119, win 501, length 1376: HTTP
14:43:26.291734 IP 10.4.18.169.49879 > 85.239.53.219.http: Flags [.], ack 84836, win 512, length 0
14:43:26.291856 IP 85.239.53.219.http > 10.4.18.169.49879: Flags [.], seq 87588:88964, ack 119, win 501, length 1376: HTTP
14:43:26.291973 IP 85.239.53.219.http > 10.4.18.169.49879: Flags [P.], seq 88964:90340, ack 119, win 501, length 1376: HTTP
14:43:26.291973 IP 10.4.18.169.49879 > 85.239.53.219.http: Flags [.], ack 87588, win 512, length 0
14:43:26.292096 IP 85.239.53.219.http > 10.4.18.169.49879: Flags [.], seq 90340:91716, ack 119, win 501, length 1376: HTTP
14:43:26.292212 IP 85.239.53.219.http > 10.4.18.169.49879: Flags [P.], seq 91716:93092, ack 119, win 501, length 1376: HTTP
14:43:26.292212 IP 10.4.18.169.49879 > 85.239.53.219.http: Flags [.], ack 90340, win 512, length 0
14:43:26.292335 IP 85.239.53.219.http > 10.4.18.169.49879: Flags [.], seq 93092:94468, ack 119, win 501, length 1376: HTTP
14:43:26.292452 IP 85.239.53.219.http > 10.4.18.169.49879: Flags [P.], seq 94468:95844, ack 119, win 501, length 1376: HTTP
14:43:26.292452 IP 10.4.18.169.49879 > 85.239.53.219.http: Flags [.], ack 93092, win 512, length 0
14:43:26.292515 IP 10.4.18.169.49879 > 85.239.53.219.http: Flags [.], ack 95844, win 512, length 0
14:43:26.355443 IP 85.239.53.219.http > 10.4.18.169.49879: Flags [.], seq 95844:97220, ack 119, win 501, length 1376: HTTP
14:43:26.355550 IP 85.239.53.219.http > 10.4.18.169.49879: Flags [P.], seq 97220:98596, ack 119, win 501, length 1376: HTTP
14:43:26.355667 IP 85.239.53.219.http > 10.4.18.169.49879: Flags [.], seq 98596:99972, ack 119, win 501, length 1376: HTTP
14:43:26.355783 IP 85.239.53.219.http > 10.4.18.169.49879: Flags [P.], seq 99972:101348, ack 119, win 501, length 1376: HTTP
14:43:26.355899 IP 85.239.53.219.http > 10.4.18.169.49879: Flags [.], seq 101348:102724, ack 119, win 501, length 1376: HTTP
14:43:26.356015 IP 85.239.53.219.http > 10.4.18.169.49879: Flags [P.], seq 102724:104100, ack 119, win 501, length 1376: HTTP
14:43:26.356270 IP 10.4.18.169.49879 > 85.239.53.219.http: Flags [.], ack 104100, win 512, length 0
14:43:26.369806 IP 85.239.53.219.http > 10.4.18.169.49879: Flags [.], seq 104100:105476, ack 119, win 501, length 1376: HTTP
14:43:26.369907 IP 85.239.53.219.http > 10.4.18.169.49879: Flags [P.], seq 105476:106852, ack 119, win 501, length 1376: HTTP
14:43:26.370024 IP 85.239.53.219.http > 10.4.18.169.49879: Flags [.], seq 106852:108228, ack 119, win 501, length 1376: HTTP
14:43:26.370141 IP 85.239.53.219.http > 10.4.18.169.49879: Flags [P.], seq 108228:109604, ack 119, win 501, length 1376: HTTP
14:43:26.370257 IP 85.239.53.219.http > 10.4.18.169.49879: Flags [.], seq 109604:110980, ack 119, win 501, length 1376: HTTP
14:43:26.370373 IP 85.239.53.219.http > 10.4.18.169.49879: Flags [P.], seq 110980:112356, ack 119, win 501, length 1376: HTTP
14:43:26.370490 IP 85.239.53.219.http > 10.4.18.169.49879: Flags [.], seq 112356:113732, ack 119, win 501, length 1376: HTTP
14:43:26.370606 IP 85.239.53.219.http > 10.4.18.169.49879: Flags [P.], seq 113732:115108, ack 119, win 501, length 1376: HTTP
14:43:26.370723 IP 85.239.53.219.http > 10.4.18.169.49879: Flags [.], seq 115108:116484, ack 119, win 501, length 1376: HTTP
14:43:26.370723 IP 10.4.18.169.49879 > 85.239.53.219.http: Flags [.], ack 112356, win 512, length 0
14:43:26.370723 IP 10.4.18.169.49879 > 85.239.53.219.http: Flags [.], ack 115108, win 512, length 0
14:43:26.370851 IP 85.239.53.219.http > 10.4.18.169.49879: Flags [P.], seq 116484:117860, ack 119, win 501, length 1376: HTTP
14:43:26.370968 IP 85.239.53.219.http > 10.4.18.169.49879: Flags [.], seq 117860:119236, ack 119, win 501, length 1376: HTTP
14:43:26.371084 IP 85.239.53.219.http > 10.4.18.169.49879: Flags [P.], seq 119236:120612, ack 119, win 501, length 1376: HTTP
14:43:26.371084 IP 10.4.18.169.49879 > 85.239.53.219.http: Flags [.], ack 117860, win 512, length 0
14:43:26.371207 IP 85.239.53.219.http > 10.4.18.169.49879: Flags [.], seq 120612:121988, ack 119, win 501, length 1376: HTTP
14:43:26.371207 IP 10.4.18.169.49879 > 85.239.53.219.http: Flags [.], ack 120612, win 512, length 0
14:43:26.371330 IP 85.239.53.219.http > 10.4.18.169.49879: Flags [P.], seq 121988:123364, ack 119, win 501, length 1376: HTTP
14:43:26.371446 IP 85.239.53.219.http > 10.4.18.169.49879: Flags [.], seq 123364:124740, ack 119, win 501, length 1376: HTTP
14:43:26.371563 IP 85.239.53.219.http > 10.4.18.169.49879: Flags [.], seq 124740:126116, ack 119, win 501, length 1376: HTTP
14:43:26.371563 IP 10.4.18.169.49879 > 85.239.53.219.http: Flags [.], ack 123364, win 512, length 0
14:43:26.371686 IP 85.239.53.219.http > 10.4.18.169.49879: Flags [P.], seq 126116:127492, ack 119, win 501, length 1376: HTTP
14:43:26.371686 IP 10.4.18.169.49879 > 85.239.53.219.http: Flags [.], ack 126116, win 512, length 0
14:43:26.371809 IP 85.239.53.219.http > 10.4.18.169.49879: Flags [.], seq 127492:128868, ack 119, win 501, length 1376: HTTP
14:43:26.371925 IP 85.239.53.219.http > 10.4.18.169.49879: Flags [P.], seq 128868:130244, ack 119, win 501, length 1376: HTTP
14:43:26.372042 IP 85.239.53.219.http > 10.4.18.169.49879: Flags [.], seq 130244:131620, ack 119, win 501, length 1376: HTTP
14:43:26.372042 IP 10.4.18.169.49879 > 85.239.53.219.http: Flags [.], ack 128868, win 512, length 0
14:43:26.372165 IP 85.239.53.219.http > 10.4.18.169.49879: Flags [P.], seq 131620:132996, ack 119, win 501, length 1376: HTTP
14:43:26.372282 IP 85.239.53.219.http > 10.4.18.169.49879: Flags [.], seq 132996:134372, ack 119, win 501, length 1376: HTTP
14:43:26.372282 IP 10.4.18.169.49879 > 85.239.53.219.http: Flags [.], ack 131620, win 512, length 0
14:43:26.372404 IP 85.239.53.219.http > 10.4.18.169.49879: Flags [P.], seq 134372:135748, ack 119, win 501, length 1376: HTTP
14:43:26.372521 IP 85.239.53.219.http > 10.4.18.169.49879: Flags [.], seq 135748:137124, ack 119, win 501, length 1376: HTTP
14:43:26.372521 IP 10.4.18.169.49879 > 85.239.53.219.http: Flags [.], ack 134372, win 512, length 0
14:43:26.372643 IP 85.239.53.219.http > 10.4.18.169.49879: Flags [P.], seq 137124:138500, ack 119, win 501, length 1376: HTTP
14:43:26.372760 IP 85.239.53.219.http > 10.4.18.169.49879: Flags [.], seq 138500:139876, ack 119, win 501, length 1376: HTTP
14:43:26.372760 IP 10.4.18.169.49879 > 85.239.53.219.http: Flags [.], ack 137124, win 512, length 0
14:43:26.372883 IP 85.239.53.219.http > 10.4.18.169.49879: Flags [P.], seq 139876:141252, ack 119, win 501, length 1376: HTTP
14:43:26.372883 IP 10.4.18.169.49879 > 85.239.53.219.http: Flags [.], ack 139876, win 512, length 0
14:43:26.373006 IP 85.239.53.219.http > 10.4.18.169.49879: Flags [.], seq 141252:142628, ack 119, win 501, length 1376: HTTP
14:43:26.373122 IP 85.239.53.219.http > 10.4.18.169.49879: Flags [P.], seq 142628:144004, ack 119, win 501, length 1376: HTTP
14:43:26.373239 IP 85.239.53.219.http > 10.4.18.169.49879: Flags [.], seq 144004:145380, ack 119, win 501, length 1376: HTTP
14:43:26.373239 IP 10.4.18.169.49879 > 85.239.53.219.http: Flags [.], ack 142628, win 512, length 0
14:43:26.373362 IP 85.239.53.219.http > 10.4.18.169.49879: Flags [P.], seq 145380:146756, ack 119, win 501, length 1376: HTTP
14:43:26.373362 IP 10.4.18.169.49879 > 85.239.53.219.http: Flags [.], ack 145380, win 512, length 0
14:43:26.373484 IP 85.239.53.219.http > 10.4.18.169.49879: Flags [.], seq 146756:148132, ack 119, win 501, length 1376: HTTP
14:43:26.373601 IP 85.239.53.219.http > 10.4.18.169.49879: Flags [P.], seq 148132:149508, ack 119, win 501, length 1376: HTTP
14:43:26.373718 IP 85.239.53.219.http > 10.4.18.169.49879: Flags [.], seq 149508:150884, ack 119, win 501, length 1376: HTTP
14:43:26.373718 IP 10.4.18.169.49879 > 85.239.53.219.http: Flags [.], ack 148132, win 512, length 0
14:43:26.373841 IP 85.239.53.219.http > 10.4.18.169.49879: Flags [P.], seq 150884:152260, ack 119, win 501, length 1376: HTTP
14:43:26.373841 IP 10.4.18.169.49879 > 85.239.53.219.http: Flags [.], ack 150884, win 512, length 0
14:43:26.373964 IP 85.239.53.219.http > 10.4.18.169.49879: Flags [.], seq 152260:153636, ack 119, win 501, length 1376: HTTP
14:43:26.374079 IP 85.239.53.219.http > 10.4.18.169.49879: Flags [P.], seq 153636:155012, ack 119, win 501, length 1376: HTTP
14:43:26.374196 IP 85.239.53.219.http > 10.4.18.169.49879: Flags [.], seq 155012:156388, ack 119, win 501, length 1376: HTTP
14:43:26.374196 IP 10.4.18.169.49879 > 85.239.53.219.http: Flags [.], ack 153636, win 512, length 0
14:43:26.374328 IP 85.239.53.219.http > 10.4.18.169.49879: Flags [P.], seq 156388:157764, ack 119, win 501, length 1376: HTTP
14:43:26.374435 IP 85.239.53.219.http > 10.4.18.169.49879: Flags [.], seq 157764:159140, ack 119, win 501, length 1376: HTTP
14:43:26.374435 IP 10.4.18.169.49879 > 85.239.53.219.http: Flags [.], ack 156388, win 512, length 0
14:43:26.374558 IP 85.239.53.219.http > 10.4.18.169.49879: Flags [P.], seq 159140:160516, ack 119, win 501, length 1376: HTTP
14:43:26.374675 IP 85.239.53.219.http > 10.4.18.169.49879: Flags [.], seq 160516:161892, ack 119, win 501, length 1376: HTTP
14:43:26.374675 IP 10.4.18.169.49879 > 85.239.53.219.http: Flags [.], ack 159140, win 512, length 0
14:43:26.374807 IP 85.239.53.219.http > 10.4.18.169.49879: Flags [P.], seq 161892:163268, ack 119, win 501, length 1376: HTTP
14:43:26.374914 IP 85.239.53.219.http > 10.4.18.169.49879: Flags [.], seq 163268:164644, ack 119, win 501, length 1376: HTTP
14:43:26.374914 IP 10.4.18.169.49879 > 85.239.53.219.http: Flags [.], ack 161892, win 512, length 0
14:43:26.375037 IP 85.239.53.219.http > 10.4.18.169.49879: Flags [P.], seq 164644:166020, ack 119, win 501, length 1376: HTTP
14:43:26.375153 IP 85.239.53.219.http > 10.4.18.169.49879: Flags [.], seq 166020:167396, ack 119, win 501, length 1376: HTTP
14:43:26.375153 IP 10.4.18.169.49879 > 85.239.53.219.http: Flags [.], ack 164644, win 512, length 0
14:43:26.375277 IP 85.239.53.219.http > 10.4.18.169.49879: Flags [P.], seq 167396:168772, ack 119, win 501, length 1376: HTTP
14:43:26.375393 IP 85.239.53.219.http > 10.4.18.169.49879: Flags [.], seq 168772:170148, ack 119, win 501, length 1376: HTTP
14:43:26.375393 IP 10.4.18.169.49879 > 85.239.53.219.http: Flags [.], ack 167396, win 512, length 0
14:43:26.375516 IP 85.239.53.219.http > 10.4.18.169.49879: Flags [P.], seq 170148:171524, ack 119, win 501, length 1376: HTTP
14:43:26.375516 IP 10.4.18.169.49879 > 85.239.53.219.http: Flags [.], ack 170148, win 512, length 0
14:43:26.375638 IP 85.239.53.219.http > 10.4.18.169.49879: Flags [.], seq 171524:172900, ack 119, win 501, length 1376: HTTP
14:43:26.375755 IP 85.239.53.219.http > 10.4.18.169.49879: Flags [P.], seq 172900:174276, ack 119, win 501, length 1376: HTTP
14:43:26.375872 IP 85.239.53.219.http > 10.4.18.169.49879: Flags [.], seq 174276:175652, ack 119, win 501, length 1376: HTTP
14:43:26.375872 IP 10.4.18.169.49879 > 85.239.53.219.http: Flags [.], ack 172900, win 512, length 0
14:43:26.375994 IP 85.239.53.219.http > 10.4.18.169.49879: Flags [P.], seq 175652:177028, ack 119, win 501, length 1376: HTTP
14:43:26.375994 IP 10.4.18.169.49879 > 85.239.53.219.http: Flags [.], ack 175652, win 512, length 0
14:43:26.376117 IP 85.239.53.219.http > 10.4.18.169.49879: Flags [.], seq 177028:178404, ack 119, win 501, length 1376: HTTP
14:43:26.376233 IP 85.239.53.219.http > 10.4.18.169.49879: Flags [P.], seq 178404:179780, ack 119, win 501, length 1376: HTTP
14:43:26.376350 IP 85.239.53.219.http > 10.4.18.169.49879: Flags [.], seq 179780:181156, ack 119, win 501, length 1376: HTTP
14:43:26.376350 IP 10.4.18.169.49879 > 85.239.53.219.http: Flags [.], ack 178404, win 512, length 0
14:43:26.376473 IP 85.239.53.219.http > 10.4.18.169.49879: Flags [P.], seq 181156:182532, ack 119, win 501, length 1376: HTTP
14:43:26.376473 IP 10.4.18.169.49879 > 85.239.53.219.http: Flags [.], ack 181156, win 512, length 0
14:43:26.376596 IP 85.239.53.219.http > 10.4.18.169.49879: Flags [.], seq 182532:183908, ack 119, win 501, length 1376: HTTP
14:43:26.376712 IP 85.239.53.219.http > 10.4.18.169.49879: Flags [P.], seq 183908:185284, ack 119, win 501, length 1376: HTTP
14:43:26.376829 IP 85.239.53.219.http > 10.4.18.169.49879: Flags [.], seq 185284:186660, ack 119, win 501, length 1376: HTTP
14:43:26.376829 IP 10.4.18.169.49879 > 85.239.53.219.http: Flags [.], ack 183908, win 512, length 0
14:43:26.376951 IP 85.239.53.219.http > 10.4.18.169.49879: Flags [P.], seq 186660:188036, ack 119, win 501, length 1376: HTTP
14:43:26.377068 IP 85.239.53.219.http > 10.4.18.169.49879: Flags [P.], seq 188036:189412, ack 119, win 501, length 1376: HTTP
14:43:26.377068 IP 10.4.18.169.49879 > 85.239.53.219.http: Flags [.], ack 186660, win 512, length 0
14:43:26.377191 IP 85.239.53.219.http > 10.4.18.169.49879: Flags [.], seq 189412:190788, ack 119, win 501, length 1376: HTTP
14:43:26.377308 IP 85.239.53.219.http > 10.4.18.169.49879: Flags [P.], seq 190788:192164, ack 119, win 501, length 1376: HTTP
14:43:26.377308 IP 10.4.18.169.49879 > 85.239.53.219.http: Flags [.], ack 189412, win 512, length 0
14:43:26.377481 IP 85.239.53.219.http > 10.4.18.169.49879: Flags [.], seq 192164:193540, ack 119, win 501, length 1376: HTTP
14:43:26.377547 IP 85.239.53.219.http > 10.4.18.169.49879: Flags [P.], seq 193540:194916, ack 119, win 501, length 1376: HTTP
14:43:26.377547 IP 10.4.18.169.49879 > 85.239.53.219.http: Flags [.], ack 192164, win 512, length 0
14:43:26.377669 IP 85.239.53.219.http > 10.4.18.169.49879: Flags [.], seq 194916:196292, ack 119, win 501, length 1376: HTTP
14:43:26.377786 IP 85.239.53.219.http > 10.4.18.169.49879: Flags [P.], seq 196292:197668, ack 119, win 501, length 1376: HTTP
14:43:26.377786 IP 10.4.18.169.49879 > 85.239.53.219.http: Flags [.], ack 194916, win 512, length 0
14:43:26.377909 IP 85.239.53.219.http > 10.4.18.169.49879: Flags [.], seq 197668:199044, ack 119, win 501, length 1376: HTTP
14:43:26.378026 IP 85.239.53.219.http > 10.4.18.169.49879: Flags [P.], seq 199044:200420, ack 119, win 501, length 1376: HTTP
14:43:26.378026 IP 10.4.18.169.49879 > 85.239.53.219.http: Flags [.], ack 197668, win 512, length 0
14:43:26.378149 IP 85.239.53.219.http > 10.4.18.169.49879: Flags [.], seq 200420:201796, ack 119, win 501, length 1376: HTTP
14:43:26.378149 IP 10.4.18.169.49879 > 85.239.53.219.http: Flags [.], ack 200420, win 512, length 0
14:43:26.378272 IP 85.239.53.219.http > 10.4.18.169.49879: Flags [P.], seq 201796:203172, ack 119, win 501, length 1376: HTTP
14:43:26.378388 IP 85.239.53.219.http > 10.4.18.169.49879: Flags [.], seq 203172:204548, ack 119, win 501, length 1376: HTTP
14:43:26.378505 IP 85.239.53.219.http > 10.4.18.169.49879: Flags [P.], seq 204548:205924, ack 119, win 501, length 1376: HTTP
14:43:26.378505 IP 10.4.18.169.49879 > 85.239.53.219.http: Flags [.], ack 203172, win 1025, length 0
14:43:26.378505 IP 10.4.18.169.49879 > 85.239.53.219.http: Flags [.], ack 205924, win 1025, length 0
14:43:26.415065 IP 85.239.53.219.http > 10.4.18.169.49879: Flags [.], seq 205924:207300, ack 119, win 501, length 1376: HTTP
14:43:26.415120 IP 85.239.53.219.http > 10.4.18.169.49879: Flags [P.], seq 207300:208180, ack 119, win 501, length 880: HTTP
14:43:26.415844 IP 10.4.18.169.49879 > 85.239.53.219.http: Flags [.], ack 208180, win 1025, length 0
14:43:26.484210 IP 10.4.18.169.52862 > 10.4.18.4.domain: 26292+ A? api.openweathermap.org. (40)
14:43:26.490681 IP 10.4.18.4.domain > 10.4.18.169.52862: 26292 2/0/0 CNAME front-free-us-east.openweathermap.org., A 169.197.141.16 (89)
14:43:29.493609 IP 10.4.18.169.49880 > 16-141-197-169.clients.gthost.com.http: Flags [S], seq 2620488145, win 64240, options [mss 1460,nop,wscale 8,nop,nop,sackOK], length 0
14:43:29.585364 IP 16-141-197-169.clients.gthost.com.http > 10.4.18.169.49880: Flags [S.], seq 916290870, ack 2620488146, win 64240, options [mss 1396,nop,nop,sackOK,nop,wscale 7], length 0
14:43:29.586174 IP 10.4.18.169.49880 > 16-141-197-169.clients.gthost.com.http: Flags [.], ack 1, win 512, length 0
14:43:29.586374 IP 10.4.18.169.49880 > 16-141-197-169.clients.gthost.com.http: Flags [P.], seq 1:130, ack 1, win 512, length 129: HTTP: GET /data/2.5/weather?q=New%20York&appid=a9b11618d578a103e7be4de69342fcb2 HTTP/1.1
14:43:29.676047 IP 16-141-197-169.clients.gthost.com.http > 10.4.18.169.49880: Flags [.], ack 130, win 501, length 0
14:43:29.676101 IP 16-141-197-169.clients.gthost.com.http > 10.4.18.169.49880: Flags [P.], seq 1:802, ack 130, win 501, length 801: HTTP: HTTP/1.1 200 OK
14:43:29.677183 IP 10.4.18.169.49880 > 16-141-197-169.clients.gthost.com.http: Flags [F.], seq 130, ack 802, win 509, length 0
14:43:29.750193 IP 16-141-197-169.clients.gthost.com.http > 10.4.18.169.49880: Flags [F.], seq 802, ack 131, win 501, length 0
14:43:29.750985 IP 10.4.18.169.49880 > 16-141-197-169.clients.gthost.com.http: Flags [.], ack 803, win 509, length 0
14:43:30.973187 ARP, Request who-has 10.4.18.169 (00:27:0e:c1:63:55 (oui Unknown)) tell 10.4.18.1, length 46
14:43:30.974048 ARP, Reply 10.4.18.169 is-at 00:27:0e:c1:63:55 (oui Unknown), length 46
14:43:39.769357 IP 10.4.18.169.60410 > 10.4.18.4.domain: 44857+ A? api.ipify.org. (31)
14:43:39.774044 IP 10.4.18.4.domain > 10.4.18.169.60410: 44857 3/0/0 A 104.26.12.205, A 172.67.74.152, A 104.26.13.205 (79)
14:43:39.775496 IP 10.4.18.169.49881 > 104.26.12.205.https: Flags [S], seq 3219590082, win 64240, options [mss 1460,nop,wscale 8,nop,nop,sackOK], length 0
14:43:39.825122 IP 104.26.12.205.https > 10.4.18.169.49881: Flags [S.], seq 1087541043, ack 3219590083, win 65535, options [mss 1380,nop,nop,sackOK,nop,wscale 13], length 0
14:43:39.825929 IP 10.4.18.169.49881 > 104.26.12.205.https: Flags [.], ack 1, win 512, length 0
14:43:39.827746 IP 10.4.18.169.49881 > 104.26.12.205.https: Flags [P.], seq 1:270, ack 1, win 512, length 269
14:43:39.870785 IP 104.26.12.205.https > 10.4.18.169.49881: Flags [.], ack 270, win 8, length 0
14:43:39.870888 IP 104.26.12.205.https > 10.4.18.169.49881: Flags [.], seq 1:1377, ack 270, win 8, length 1376
14:43:39.871004 IP 104.26.12.205.https > 10.4.18.169.49881: Flags [.], seq 1377:2753, ack 270, win 8, length 1376
14:43:39.871120 IP 104.26.12.205.https > 10.4.18.169.49881: Flags [.], seq 2753:4129, ack 270, win 8, length 1376
14:43:39.871207 IP 104.26.12.205.https > 10.4.18.169.49881: Flags [P.], seq 4129:5175, ack 270, win 8, length 1046
14:43:39.871528 IP 10.4.18.169.49881 > 104.26.12.205.https: Flags [.], ack 5175, win 512, length 0
14:43:39.877227 IP 10.4.18.169.49881 > 104.26.12.205.https: Flags [P.], seq 270:350, ack 5175, win 512, length 80
14:43:39.879730 IP 10.4.18.169.49881 > 104.26.12.205.https: Flags [P.], seq 350:560, ack 5175, win 512, length 210
14:43:39.915215 IP 104.26.12.205.https > 10.4.18.169.49881: Flags [.], ack 560, win 8, length 0
14:43:39.990654 IP 104.26.12.205.https > 10.4.18.169.49881: Flags [P.], seq 5175:5876, ack 560, win 8, length 701
14:43:40.045557 IP 10.4.18.169.49881 > 104.26.12.205.https: Flags [.], ack 5876, win 509, length 0
14:43:44.726520 ARP, Request who-has 10.4.18.169 (00:27:0e:c1:63:55 (oui Unknown)) tell 10.4.18.4, length 46
14:43:44.727327 ARP, Reply 10.4.18.169 is-at 00:27:0e:c1:63:55 (oui Unknown), length 46
14:43:50.999053 IP 10.4.18.169.49879 > 85.239.53.219.http: Flags [P.], seq 119:386, ack 208180, win 1025, length 267: HTTP: POST /api/gateway HTTP/1.1
14:43:50.999053 IP 10.4.18.169.49879 > 85.239.53.219.http: Flags [P.], seq 386:568, ack 208180, win 1025, length 182: HTTP
14:43:51.106752 IP 85.239.53.219.http > 10.4.18.169.49879: Flags [.], ack 568, win 501, length 0
14:43:51.131312 IP 85.239.53.219.http > 10.4.18.169.49879: Flags [P.], seq 208180:208446, ack 568, win 501, length 266: HTTP: HTTP/1.1 200 OK
14:43:51.147536 IP 10.4.18.169.49879 > 85.239.53.219.http: Flags [P.], seq 568:868, ack 208446, win 1024, length 300: HTTP: POST /api/1f4b0ad7-0502-68bf-b0aa-fe57ec45c025/tasks HTTP/1.1
14:43:51.245016 IP 85.239.53.219.http > 10.4.18.169.49879: Flags [P.], seq 208446:208631, ack 868, win 501, length 185: HTTP: HTTP/1.1 200 OK
14:43:51.290988 IP 10.4.18.169.49879 > 85.239.53.219.http: Flags [.], ack 208631, win 1023, length 0
14:44:11.247663 IP 10.4.18.169.49882 > a-0003.dc-msedge.net.https: Flags [S], seq 2495986237, win 65535, options [mss 1460,nop,wscale 8,nop,nop,sackOK], length 0
14:44:11.248196 IP 10.4.18.169.49879 > 85.239.53.219.http: Flags [P.], seq 868:1168, ack 208631, win 1023, length 300: HTTP: POST /api/1f4b0ad7-0502-68bf-b0aa-fe57ec45c025/tasks HTTP/1.1
14:44:11.329701 IP a-0003.dc-msedge.net.https > 10.4.18.169.49882: Flags [S.], seq 3726594272, ack 2495986238, win 65535, options [mss 1396,nop,wscale 8,nop,nop,sackOK], length 0
14:44:11.330557 IP 10.4.18.169.49882 > a-0003.dc-msedge.net.https: Flags [.], ack 1, win 1024, length 0
14:44:11.330942 IP 10.4.18.169.49882 > a-0003.dc-msedge.net.https: Flags [P.], seq 1:507, ack 1, win 1024, length 506
14:44:11.364427 IP 85.239.53.219.http > 10.4.18.169.49879: Flags [P.], seq 208631:208816, ack 1168, win 501, length 185: HTTP: HTTP/1.1 200 OK
14:44:11.394721 IP a-0003.dc-msedge.net.https > 10.4.18.169.49882: Flags [.], ack 507, win 16386, length 0
14:44:11.394821 IP a-0003.dc-msedge.net.https > 10.4.18.169.49882: Flags [.], seq 1:1377, ack 507, win 16386, length 1376
14:44:11.394937 IP a-0003.dc-msedge.net.https > 10.4.18.169.49882: Flags [.], seq 1377:2753, ack 507, win 16386, length 1376
14:44:11.395495 IP 10.4.18.169.49882 > a-0003.dc-msedge.net.https: Flags [.], ack 2753, win 1024, length 0
14:44:11.395835 IP a-0003.dc-msedge.net.https > 10.4.18.169.49882: Flags [.], seq 2753:4129, ack 507, win 16386, length 1376
14:44:11.395951 IP a-0003.dc-msedge.net.https > 10.4.18.169.49882: Flags [.], seq 4129:5505, ack 507, win 16386, length 1376
14:44:11.395985 IP a-0003.dc-msedge.net.https > 10.4.18.169.49882: Flags [P.], seq 5505:5958, ack 507, win 16386, length 453
14:44:11.396125 IP 10.4.18.169.49882 > a-0003.dc-msedge.net.https: Flags [.], ack 5958, win 1024, length 0
14:44:11.407536 IP 10.4.18.169.49882 > a-0003.dc-msedge.net.https: Flags [P.], seq 507:665, ack 5958, win 1024, length 158
14:44:11.412274 IP 10.4.18.169.49879 > 85.239.53.219.http: Flags [.], ack 208816, win 1022, length 0
14:44:11.459503 IP a-0003.dc-msedge.net.https > 10.4.18.169.49882: Flags [.], ack 665, win 16385, length 0
14:44:11.459503 IP a-0003.dc-msedge.net.https > 10.4.18.169.49882: Flags [P.], seq 5958:6300, ack 665, win 16385, length 342
14:44:11.459503 IP a-0003.dc-msedge.net.https > 10.4.18.169.49882: Flags [P.], seq 6300:6369, ack 665, win 16385, length 69
14:44:11.460284 IP 10.4.18.169.49882 > a-0003.dc-msedge.net.https: Flags [.], ack 6369, win 1022, length 0
14:44:11.461001 IP 10.4.18.169.49882 > a-0003.dc-msedge.net.https: Flags [P.], seq 665:752, ack 6369, win 1022, length 87
14:44:11.461001 IP 10.4.18.169.49882 > a-0003.dc-msedge.net.https: Flags [P.], seq 752:790, ack 6369, win 1022, length 38
14:44:11.461001 IP 10.4.18.169.49882 > a-0003.dc-msedge.net.https: Flags [P.], seq 790:1030, ack 6369, win 1022, length 240
14:44:11.524666 IP a-0003.dc-msedge.net.https > 10.4.18.169.49882: Flags [.], ack 752, win 16385, length 0
14:44:11.524666 IP a-0003.dc-msedge.net.https > 10.4.18.169.49882: Flags [P.], seq 6369:6407, ack 752, win 16385, length 38
14:44:11.524666 IP a-0003.dc-msedge.net.https > 10.4.18.169.49882: Flags [.], ack 790, win 16385, length 0
14:44:11.524666 IP a-0003.dc-msedge.net.https > 10.4.18.169.49882: Flags [.], ack 1030, win 16384, length 0
14:44:11.525455 IP 10.4.18.169.49882 > a-0003.dc-msedge.net.https: Flags [.], ack 6407, win 1022, length 0
14:44:11.589542 IP a-0003.dc-msedge.net.https > 10.4.18.169.49882: Flags [P.], seq 6407:7242, ack 1030, win 16384, length 835
14:44:11.590338 IP 10.4.18.169.49882 > a-0003.dc-msedge.net.https: Flags [.], ack 7242, win 1018, length 0
14:44:15.962437 ARP, Request who-has 10.4.18.169 (00:27:0e:c1:63:55 (oui Unknown)) tell 10.4.18.1, length 46
14:44:15.963162 ARP, Reply 10.4.18.169 is-at 00:27:0e:c1:63:55 (oui Unknown), length 46
14:44:31.339942 ARP, Request who-has 10.4.18.4 (00:21:9b:f2:25:36 (oui Unknown)) tell 10.4.18.169, length 46
14:44:31.339994 ARP, Reply 10.4.18.4 is-at 00:21:9b:f2:25:36 (oui Unknown), length 46
14:44:31.368177 IP 10.4.18.169.49879 > 85.239.53.219.http: Flags [P.], seq 1168:1468, ack 208816, win 1022, length 300: HTTP: POST /api/1f4b0ad7-0502-68bf-b0aa-fe57ec45c025/tasks HTTP/1.1
14:44:31.474709 IP 85.239.53.219.http > 10.4.18.169.49879: Flags [P.], seq 208816:209001, ack 1468, win 501, length 185: HTTP: HTTP/1.1 200 OK
14:44:31.523345 IP 10.4.18.169.49879 > 85.239.53.219.http: Flags [.], ack 209001, win 1021, length 0
14:44:51.478564 IP 10.4.18.169.49879 > 85.239.53.219.http: Flags [P.], seq 1468:1768, ack 209001, win 1021, length 300: HTTP: POST /api/1f4b0ad7-0502-68bf-b0aa-fe57ec45c025/tasks HTTP/1.1
14:44:51.583608 IP 85.239.53.219.http > 10.4.18.169.49879: Flags [P.], seq 209001:209186, ack 1768, win 501, length 185: HTTP: HTTP/1.1 200 OK
14:44:51.625252 IP 10.4.18.169.49879 > 85.239.53.219.http: Flags [.], ack 209186, win 1021, length 0
14:44:56.339224 ARP, Request who-has 10.4.18.1 (00:13:80:28:e1:96 (oui Unknown)) tell 10.4.18.169, length 46
14:44:56.339224 ARP, Reply 10.4.18.1 is-at 00:13:80:28:e1:96 (oui Unknown), length 46
14:44:56.474180 ARP, Request who-has 10.4.18.169 (00:27:0e:c1:63:55 (oui Unknown)) tell 10.4.18.1, length 46
14:44:56.474937 ARP, Reply 10.4.18.169 is-at 00:27:0e:c1:63:55 (oui Unknown), length 46
14:45:05.526454 IP 10.4.18.169.49881 > 104.26.12.205.https: Flags [F.], seq 560, ack 5876, win 509, length 0
